#,IMONumber,VesselName,VesselTypeCode,InspectionDate,InspectionAuthority,FlagCode,InspectionPort,InspectionType,Detention,Ship_Deficiencies,Deficiency_Description,Technical_ISM_Manager,CountryCode,Website,Email,Phone,Address,CompanyIMO,DateModified
1,9433157,MSC JENNIFER II,,6/7/2024,Ireland,,Dublin-Dublin Ferryport Terminals,Initial,FALSE,2,"18425, Access / structural features (ship), Labour conditions - Health protection, medical care, ...",MSC Shipmanagement Ltd,,,[redacted],[redacted],"MSC House, 8, Spyrou Kyprianou Avenue, 3070 , Limassol, Cyprus",1535947,6/8/2024
2,9960227,DAISY LEADER,,6/7/2024,Belgium,,Zeebrugge,Initial,FALSE,9,"14606, Diesel engine relating to air pollution control, Pollution prevention - Marpol Annex VI, 1...",NYK Shipmanagement Pte Ltd,,,[redacted],[redacted],"15-01, HarbourFront Tower One, 1, Harbourfront Place, Singapore, Singapore",1968365,6/8/2024
3,9962598,MSC LORENZA,,6/7/2024,United Kingdom,,Felixstowe,Initial,FALSE,1,"14606, Diesel engine relating to air pollution control, Pollution prevention - Marpol Annex VI, 1...",MSC Shipmanagement Ltd,,,[redacted],[redacted],"MSC House, 8, Spyrou Kyprianou Avenue, 3070 , Limassol, Cyprus",1535947,6/8/2024
4,9393539,AAL GEELONG,,6/7/2024,Finland,,Brahestad (Raahe),Detailed,FALSE,2,"14405, Crew training and familiarization, Pollution prevention - Marpol Annex IV, 1011, Not as re...",Columbia Shipmanagement Ltd,,,[redacted],[redacted],"Columbia House, 21, Spyrou Kyprianou Avenue, Limassol, Cyprus",0778064,6/8/2024
5,9175171,METIN HUSEYNOV,,6/7/2024,Greece,,Thessaloniki,Follow-up,FALSE,1,"11110, Stowage and provision of liferafts, Life saving appliances, 1011, Not as required",PALMALI GEMICILIK VE ACENTELIK,,,[redacted],[redacted],", , Turkey",4079336,6/8/2024
6,9158654,AQUA SOLUNDOY,,6/7/2024,United Kingdom,,Stromness,Detailed,FALSE,5,"10106, Compass correction log, Safety of Navigation, 1000, Missing,01320, Garbage record book, Ce...",,,,[redacted],[redacted],", ,",,6/8/2024
7,9195377,HAV ALDA,,6/7/2024,United Kingdom,,Fairlie,Detailed,FALSE,7,"05115, Radio log (diary), Radio Communications, 1011, Not as required,10129, Navigation records, ...",Navigare Shipping Sp/F,,,[redacted],[redacted],"vio Trollaklett 21, FO660, Soldafjord, Faroe Islands",1247739,6/8/2024
8,9973054,LIGNUM WEB,,6/7/2024,Italy,,Ravenna,Initial,FALSE,3,"04108, Muster list, Emergency Systems, 1031, Incomplete,07124, Maintenance of Fire protection sys...",BLUEOCEAN SHIPMANAGEMENT INTL,,,[redacted],[redacted],"Room 8, 3rd Floor, Newtown Boulevard Building, Newtown Boulevard, Cebu City, Philippines",6409613,6/8/2024
9,8912302,YEOMAN BRIDGE,,6/7/2024,United Kingdom,,Glensanda,Follow-up,FALSE,5,"04102, Emergency fire pump and its pipes, Emergency Systems, 1082, Inoperative,18302, Sanitary Fa...",SMT Shipping Poland sp zoo,,,[redacted],[redacted],"ul Boleslawa Chrobrego, Sopot, Poland",5926470,6/8/2024
10,7638105,ELMAS,,6/7/2024,Bulgaria,,Burgas,Follow-up,FALSE,8,"03102, Freeboard marks, Water/Weathertight conditions, 1011, Not as required,01123, Continuous sy...",Barri Maritime LTD,,,[redacted],[redacted],"Oganlik Yeni Mah. Baltaci Mehmet Pasa Sok. No:4B, Daire 66 AC Moment Yapi Sitesi Kartal , Istanbu...",N/A,6/8/2024
11,9480722,TROMS CAPELLA,,6/7/2024,Germany,,Bremerhaven,Detailed,FALSE,3,"01315, Oil record book, Certificate & Documentation - Documents, 1011, Not as required,11117, Lif...",Tidewater Marine UK Ltd,,,[redacted],[redacted],"The Exchange 1, 62-104, Market Street, Aberdeen, United Kingdom",0588883,6/8/2024
12,9282742,LIBRA XS,,6/7/2024,Slovenia,,Koper,Follow-up,FALSE,7,"01123, Continuous synopsis record, Certificate & Documentation - Ship Certificates, 1000, Missing...",Yihai Ship Management Pte Ltd,,,[redacted],[redacted],", , Singapore",6292821,6/8/2024
13,9522893,LIBERTY BAY,,6/7/2024,Norway,,Fredrikstad,Detailed,FALSE,1,"01101, Cargo Ship Safety Equipment (including exemption), Certificate & Documentation - Ship Cert...",VG Shipmanagement SA,,,[redacted],[redacted],", , Greece",6232390,6/8/2024
14,8908466,ISLE OF INNISFREE,,6/7/2024,France,,Calais,Follow-up,FALSE,,,Matrix Ship Management Ltd,,,[redacted],[redacted],"Spyrou Kyprianou Avenue, Limassol, Cyprus",5642516,6/8/2024
15,9513907,WAIMEA,,6/7/2024,Ireland,,Aughinish Island,Follow-up,FALSE,,,Unisea Bulk Ltd,,,[redacted],[redacted],"Xenias Street, Kifisia, Athens, Greece",6009120,6/8/2024
16,9953365,CL ZHANGJIAJIE,,6/7/2024,Croatia,,Split,Detailed,FALSE,,,Synergy Marine Pte Ltd,,,[redacted],[redacted],"10-11/12, West Tower, Great World City, 1, Kim Seng Promenade, Great World City, Singapore, Singa...",5507517,6/8/2024
17,6617855,MISTRAL,,6/7/2024,Germany,,Lubeck,Detailed,FALSE,,,Mistral Shipping Co Ltd,,,[redacted],[redacted],", , Antigua and Barbuda",1822366,6/8/2024
18,9487823,THOR OMEGA,,6/7/2024,Norway,,Kristiansund,Initial,FALSE,,,Thor P/F,,,[redacted],[redacted],", , Faroe Islands",1711469,6/8/2024
19,9946477,HAFNIA LILLESAND,,6/7/2024,United Kingdom,,Teesport,Initial,FALSE,,,BW Fleet Management Pte Ltd,,,[redacted],[redacted],", , Singapore",5435373,6/8/2024
20,9667722,CHISE BULKER,,6/7/2024,Spain,,Castellon de la Plana,Initial,FALSE,,,New Century Overseas Mgmt Inc,,,[redacted],[redacted],", , Philippines",1887626,6/8/2024
21,9143790,YAKOOT,,6/7/2024,Spain,,Valencia,Initial,FALSE,,,White Line Shipping & Cargo,,,[redacted],[redacted],", , United Arab Emirates",5231323,6/8/2024
22,9525302,MAERSK CALABAR,,6/7/2024,Spain,,Algeciras,Initial,FALSE,,,Maersk A/S,,,[redacted],[redacted],"Esplanaden, Copenhagen, Denmark",5808451,6/8/2024
23,1013107,VERTIGE,,6/7/2024,Greece,,Argostolion,Initial,FALSE,,,,,,[redacted],[redacted],", ,",,6/8/2024
24,9951226,WADDENSTROOM,,6/7/2024,Germany,,Brunsbuttel,Initial,FALSE,,,,,,[redacted],[redacted],", ,",,6/8/2024
25,9545065,ARIETTA,Bulk,1/13/2023,United States of America,MTA,"Baltimore, Maryland",Initial,FALSE,1,System: 13 - Propulsion and Auxiliary Machinery Sub-System: N/A - No Subsystem Cause: Improper/La...,Alloceans Shipping Co Ltd,GRC,,[redacted],[redacted],"225-227 Kifissias Ave, ""ANAVRYTA 2"" Building 14561, Kifissia Greece",0544545,6/7/2024
26,9308091,CONSTELLATION,Tank,4/9/2024,United States of America,MAI,New York,Initial,FALSE,1,System: 07 - Fire Safety Sub-System: N/A - No Subsystem Component: 07199 - Other (fire safety) Ca...,,,,[redacted],[redacted],,,6/7/2024
27,8841632,VOLGO-BALT 213,Gen,6/6/2024,Turkey,PAN,Samsun,Initial,FALSE,6,SAFETY OF NAVIGATION (Signalling lamp) ; CARGO OPERATIONS INCLUDING EQUIPMENT (Cargo Securing Man...,Orbital Ship Management Co,TRK,,[redacted],[redacted],"Block B, Apartmani 13, Nadide Sokak 110, Mehmetnezihiozmen M, Gungoren, 34169 Istanbul, Turkey.",5442035,6/7/2024
28,9519171,DONNA JUDI,Bulk,2/27/2024,Russia,SVC,Novorossiysk,Detailed,FALSE,2,SAFETY OF NAVIGATION (Magnetic compass) ; LIFE SAVING APPLIANCES (Lifebuoys incl. provision and d...,Athenai Management Services Ltd,GRC,,[redacted],[redacted],"1St Floor, 83, Leoforos Poseidonos, Glyfada, 166 74, Athens",6125813,6/7/2024
29,9575888,KFS MERYEM ANA,Gen,6/6/2024,Turkey,PAN,Zonguldak,Detailed,FALSE,4,SAFETY OF NAVIGATION (Echo sounder) ; EMERGENCY SYSTEMS (Emergency source of power - Emergency ge...,KFS Maritime Co,TRK,,[redacted],[redacted],"C/O Canakcesme Denizcilik Ticaret Sanayi Ltd , A Blok, Yali Apartmani, Kucukyali Caddesi 10/1, Ya...",6119253,6/7/2024
30,9297125,SEA ARIES,Gen,6/6/2024,Turkey,BZE,Samsun,Detailed,FALSE,6,SAFETY OF NAVIGATION (Charts); CARGO OPERATIONS INCLUDING EQUIPMENT (Cargo Securing Manual) ; POL...,Optimal Denizcilik Tasimacilik Ltd Sti,TRK,http://www.optimalshipping.com/,[redacted],[redacted],"Daire 33, Levent Life 1, Dereboyu Caddesi 6, Ortabiyir Mah, Kagithane, 34413 Istanbul, Turkey.",5910841,6/7/2024
31,9110901,ELA,Bulk,3/23/2024,Turkey,MTA,Gulluk,Detailed,FALSE,9,Safety of Navigation - Voyage data recorder (VDR) / Simplified Voyage data recorder (S-VDR) Missi...,Gamma Denizcilik Nakliyat (Gamma Shipping Transport),TRK,http://www.gammashipping.com/,[redacted],[redacted],"621 Sokak 12, Ilkbahar Mah, Cankaya, 06550 Ankara, Turkey",5363531,6/7/2024
32,9423621,PRABHU PARVATI,Chem,6/6/2024,France,SNG,Marseille (gpm),Detailed,FALSE,1,Public address system Inoperative,T-Erudite Ship Managers Pvt Ltd,IND,,[redacted],[redacted],"10A, Bakhtawar, Nariman Point, Mumbai, India",5975782,6/7/2024
33,9514509,GOLDEN HORIZON,Bulk,6/7/2024,China,JPN,Rizhao,Follow-up,FALSE,7,POLLUTION PREVENTION - MARPOL ANNEX I (Oil filtering equipment) Yes 2 11104 LIFE SAVING APPLIANCE...,Asahi Shipping Co Ltd (Asahi Kaiun KK),JPN,,[redacted],[redacted],"23-1, Nishishinbashi 2-chome, Minato-ku, Tokyo, 105-0003, Japan.",1001341,6/7/2024
34,9011961,NEPTUNE,Gen,6/7/2024,Turkey,CKI,Samsun,Detailed,FALSE,6,POLLUTION PREVENTION - BALLAST WATER (Ballast Water Record Book); CERTIFICATE AND DOCUMENTATION -...,Kargo-Mahmut Can Egerci,TRK,http://www.mcekargo.com,[redacted],[redacted],"Cagdas Han, Tas Ocagi Sokak 1/25, Hasanpasa Mah, Kadikoy, 34722 Istanbul, Turkey.",5462700,6/7/2024
35,9760043,ANTHEA V,,6/6/2024,Bulgaria,,Varna,Follow-up,FALSE,2,"Other, Other, Other, Other, Other,01333, Ship specific plans for the recovery of persons from the...",Alexandria Shipping Hellas SA,,,[redacted],[redacted],", , Greece",1987991,6/7/2024
36,9948827,EMERALD SAKARA,Pass,6/6/2024,Croatia,BAH,Dubrovnik,Detailed,FALSE,1,Other (navigation) Other,Scenic Cruise Services Doo,CRT,,[redacted],[redacted],"ulica Riva Boduli 1, HR-51000 Rijeka, Croatia.",6227951,6/7/2024
37,9254733,GUTIAN TRUST,Bulk,6/6/2024,Romania,PAN,Constanta,Detailed,FALSE,5,Minimum Safe Manning Document Not properly filled ; Cargo Ship Safety Radio (including exemption)...,Shanghai Riding Wave Shipping Co Ltd,CHN,,[redacted],[redacted],"Room A-522, 188, Yesheng Lu, Pilot Free Trade Zone, Pudong Xinqu, Shanghai, China",6349923,6/7/2024
38,9370290,INDI,Gen,6/7/2024,Germany,PTG,Brunsbuttel,Detailed,FALSE,3,"Medical Equipment, medical chest, medical guide Missing equipment ; Propulsion main engine Not as...",Interscan Schiffahrtsgesellschatf Gmbh,GER,http://www.interscan.net/,[redacted],[redacted],"Raboisen 32, D - 20095 Hamburg Germany",1061526,6/7/2024
39,9528017,CLIPPER ALEXANDRIA,Bulk,6/6/2024,India,MAI,Mumbai,Initial,FALSE,4,"Load Lines (including Exemption); Fire pumps and its pipes; Lights, shapes, sound-signals; Electr...",Connaught Shipmanagement (HK) Ltd,HKG,,[redacted],[redacted],"Suite 2704, Oxford House, 979, Kings Road, Quarry Bay, Eastern, Hong Kong, China",6373279,6/7/2024
40,9355161,MADEIRA,Bulk,6/5/2024,China,LIB,Fangcheng,Initial,FALSE,1,LIVING AND WORKING CONDITIONS - WORKING CONDITIONS (Safe means of access Shore - Ship),TMS Dry Ltd,GRC,,[redacted],[redacted],"11, Fragkokklisias Street, Marousi, 151 25 Athens, Greece",5529167,6/7/2024
41,9490600,GREAT PERSEUS,Bulk,6/6/2024,Turkey,PAN,Kdz.eregli,Detailed,FALSE,3,LIVING AND WORKING CONDITIONS - LIVING CONDITIONS (Ventilation (Accommodation) ) ; LIVING AND WOR...,Santoku Senpaku Co Ltd,JPN,www.santokuship.co.jp,[redacted],[redacted],"Santoku Senpaku Bldg., 3-26-9 Isoji, Minato-ku, Osaka 552-0003 JAPAN",1027944,6/7/2024
42,9669720,ZHE WU 188,Bulk,6/7/2024,Russia,CHN,Nakhodka,Follow-up,FALSE,1,LIFE SAVING APPLIANCES (Operational readiness of lifesaving appliances),Zhoushan Putuo Jiarun Shipping Management Co Ltd,CHN,,[redacted],[redacted],"Room 403, Fortune Building, 185, Caishi Lu, Shenjiamen Jiedao, Putuo Qu, Zhoushan, Zhejiang, 3161...",5483396,6/7/2024
43,9145671,HAO HUNG 66,Bulk,12/15/2023,Vietnam,PAN,Quangninh,Initial,FALSE,3,LIFE SAVING APPLIANCES (Lifeboats) No 2 10116 SAFETY OF NAVIGATION (Nautical publications) No 3 1...,Van Loc Hung International Sea Shipping Co Ltd (Van Loc Hung Iss Co Ltd),VNM,,[redacted],[redacted],"A15-A17 Bach Dang 1, Ward 2, Tan Binh District, Ho Chi Minh City, Vietnam",6359978,6/7/2024
44,9113032,LIZA,Gen,6/5/2024,South Korea,RUS,Gwangyang,Initial,FALSE,1,LIFE SAVING APPLIANCES (Lifeboats),Liza LLC,RUS,,[redacted],[redacted],"ul Kupecheskaya 24, Nakhodka, Primorskiy kray, 692905, Russia",6241000,6/7/2024
45,9591741,BEAM,Bulk,6/6/2024,Russia,BBD,Taman,Detailed,FALSE,4,"LABOUR CONDITIONS-HEALTH PROTECTION, MEDICAL CARE,SOCIAL SECURITY (Steam pipes, pressure pipes, w...",Spark Gemi Isletmeciligi AS (Spark Ship Management SA),TRK,,[redacted],[redacted],"Daire 55, Kat 15, Beybi Giz Plaza, Maslak Meydan Sokak, Maslak Mah, 1, Sariyer, 34398 Istanbul, T...",6477090,6/7/2024
46,9595371,BELLA JUDI,Bulk,1/27/2024,Russia,SVC,Novorossiisk,Initial,FALSE,2,"LABOUR CONDITIONS-HEALTH PROTECTION, MEDICAL CARE,SOCIAL SECURITY (Ropes and wires) ; LABOUR COND...",Athenai Management Services Ltd,GRC,,[redacted],[redacted],"1St Floor, 83, Leoforos Poseidonos, Glyfada, 166 74, Athens",6125813,6/7/2024
47,9406051,MJ PINAR,Bulk,6/6/2024,Russia,BBD,Novorossiisk,Detailed,FALSE,3,"LABOUR CONDITIONS-HEALTH PROTECTION, MEDICAL CARE,SOCIAL SECURITY (Ropes and wires) ; FIRE SAFETY...",Norbulk Shipping UK Ltd,GBI,http://www.norbulkshipping.com,[redacted],[redacted],68 Glassford Street Glasgow G1 1UP United Kingdom,1038263,6/7/2024
48,9227819,MERAKLIS,Bulk,6/6/2024,Russia,BAH,Taman,Detailed,FALSE,5,"LABOUR CONDITIONS-ACCOMMODATION, RECREATIONAL FACILITIES, FOOD AND CATERING (Insulation) ; PROPUL...",Navegadora Transpacifica SA,PAN,,[redacted],[redacted],"65, Akti Miaouli, 185 36 Piraeus, Greece.",0533660,6/7/2024
49,9497878,WL PACIFIC,Bulk,1/3/2024,Latvia,MTA,Riga,Detailed,FALSE,2,"Labour conditions - Health protection, medical care, social security - Electrical Not as required...",Cachalot Denizcilik Ticaret AS,TRK,,[redacted],[redacted],"Yakut Sokak 2/10, Guzelyali Mah, Pendik, Istanbul, Turkey",6422790,6/7/2024
50,9507740,GAS CERBERUS,LPG,6/6/2024,France,LIB,Marseille (gpm),Detailed,FALSE,1,International Energy Efficiency Certificate Invalid,Stealth Maritime Corp SA,GRC,http://www.stealth.gr/,[redacted],[redacted],"331, Kifisias Avenue, Kifisia, 145 61 Athens, Greece",1882951,6/7/2024
51,9340908,PLEVNE,Chem,6/6/2024,Spain,MTA,Ceuta,Initial,FALSE,4,International Air Pollution Cert. Not properly filled ; Ship Energy Efficiency Management plan In...,Besiktas Likid Tasimacilik Denizcilik Ticaret AS,TRK,http://www.besiktasgroup.com/,[redacted],[redacted],"Kat 15, Blok A, Piyale Pasa Bulvari Memorial Centre, Okmeydani, Sisli, 34385 Istanbul, Turkey",1652600,6/7/2024
52,7638105,ELMAS,Gen,6/7/2024,Bulgaria,TAN,Bourgas,Detailed,FALSE,10,"ILABOUR CONDITIONS-HEALTH PROTECTION, MEDICAL CARE,SOCIAL SECURITY (Guards - fencing around dange...",Bright Star Maritime Ltd,MAI,,[redacted],[redacted],"Trust Company Complex, Ajeltake Road, Ajeltake, Majuro MH 96960, Marshall Islands.",6357407,6/7/2024
53,9489417,WL ATLANTIC,Bulk,12/5/2023,Norway,MTA,Mosjoen,Detailed,FALSE,1,ife saving appliances 11117 - Lifebuoys incl. provision and disposition Not as required,Cachalot Denizcilik Ticaret AS,TRK,,[redacted],[redacted],"Yakut Sokak 2/10, Guzelyali Mah, Pendik, Istanbul, Turkey",6422790,6/7/2024
54,9810329,INDUSTRIAL COURAGE,Gen,5/4/2023,Germany,MAR,Cuxhaven,Initial,FALSE,3,Fuel change-over procedure Missing ; Cargo Ship Safety Equipment (including exemption) Not proper...,SAL Ship Management UG,GER,,[redacted],[redacted],"Hermann-Hollerith-Strasse 10, 28355 Bremen, Germany.",5997628,6/7/2024
55,9189938,OCEANA SKY,Bulk,6/6/2024,China,PAN,Lianyungang,Follow-up,FALSE,8,FIRE SAFETY (Fixed fire extinguishing installation) No 2 07199 FIRE SAFETY (Other (fire safety)) ...,Ocean Shipmanagement Ltd,GRC,https://www.oceansmn.com/index.php,[redacted],[redacted],"44-46 Vouliagmenis Avenue Voula 16673, Athens, Greece",4140987,6/7/2024
56,9444986,PEARL RIVER BRIDGE,Cont,6/5/2024,South Korea,PAN,Busan,Initial,FALSE,1,FIRE SAFETY (Fire pumps and its pipes),K Line Ship Management Pte Ltd,SNG,http://www.klsm.com.sg/,[redacted],[redacted],"19-00, The Octagon, 105, Cecil Street, Singapore 069534",5481925,6/7/2024
57,9396763,GRACE ADALBERHT,Chem,6/7/2024,Russia,LIB,Novorossiisk,Detailed,FALSE,1,FIRE SAFETY (Fire prevention structural integrity),Cymare Navigation FZC,UAE,https://cymare.com/,[redacted],[redacted],"19th Floor Conrad Dubai Sheikh Zayed Road PO Box 5610, Dubai, UAE",6384755,6/7/2024
58,9435143,CS FORTUNE,Gen,2/8/2023,China,PAN,Dongjiakou,Follow-up,FALSE,2,"FIRE SAFETY (Fire detection and alarm system) ; WATER/WEATHERTIGHT CONDITIONS (Ventilators, air p...",Qingdao Sea Star Ships Management Co Ltd,CHN,http://www.shipmange.cn,[redacted],[redacted],"Unit A, 6th Floor, Inter Royal Building, 15, Donghai Xilu, Shinan Qu, Qingdao, Shandong, 266071, ...",5175291,6/7/2024
59,9084229,ROYAL O,Bulk,6/7/2024,Ukraine,PAL,Odesa,Detailed,FALSE,11,FIRE SAFETY (Emergency Escape Breathing Device and disposition); SAFETY OF NAVIGATION (Voyage or ...,Blue Sea Ship Management Ltd,TRK,,[redacted],[redacted],"Ic Kapi 6, Office 3F, 52104 Sokak, Livora Caddesii Sitesi, Merkez Mah, Mersin, Turkey",6320958,6/7/2024
60,9227871,LADY AYSE,Gen,6/7/2024,Georgia,PAN,Poti,Initial,FALSE,2,CERTIFICATE AND DOCUMENTATION - SHIP CERTIFICATES (International Oil Pollution Prevention (IOPP))...,Gn Denizcilik Ve Acentelik Ltd,TRK,,[redacted],[redacted],"Cenap Sahabettin Sokak 56, Kosuyolu Mah, Kadikoy, 34718 Istanbul, Turkey",5776490,6/7/2024
61,9682461,VELA,Chem,6/6/2024,Russia,HKG,Taman,Follow-up,FALSE,4,CERTIFICATE AND DOCUMENTATION - SHIP CERTIFICATES (Declaration of Maritime Labour Compliance (par...,Raffles Technical Services Pte Ltd,SNG,http://www.raffles-shipbrokers.com.sg,[redacted],[redacted],"09-04, Tan Boon Liat Building, 315, Outram Road, Singapore 169074",5549522,6/7/2024
62,9760043,ANTHEA V,Bulk,6/6/2024,Bulgaria,PAN,Varna,Detailed,FALSE,1,CERTIFICATE AND DOCUMENTATION - DOCUMENTS (Ship specific plans for the recovery of persons from t...,Alexandria Shipping (Hellas) SA,GRC,,[redacted],[redacted],"7, Omonoias Square, 104 31 Athens, Greece",1987991,6/7/2024
63,9326718,CARO,Tank,6/6/2024,Russia,VNM,Novorossiisk,Detailed,FALSE,6,CARGO OPERATIONS INCLUDING EQUIPMENT (Other (cargo)) ; CARGO OPERATIONS INCLUDING EQUIPMENT (Othe...,Ovtrans Petrol Transport Services Co Ltd,VNM,,[redacted],[redacted],"2nd Floor, 87, Nguyen Thai Hoc, Ba Dinh District, Hanoi City, Vietnam",6152733,6/7/2024
64,9309344,TLC 01,Gen,3/19/2024,Malaysia,VNM,"Kuching, Sarawak",Initial,FALSE,3,"18426 LABOUR CONDITIONS-HEALTH PROTECTION, MEDICAL CARE,SOCIAL SECURITY (Exposure to harmful leve...",Tien Phong Co Ltd (Cong Ty Tnhh Tien Phong),VNM,,[redacted],[redacted],"314, Zone 6, Diem Dien, Thai Thuy District, Thai Binh Province, Vietnam.",5586815,6/7/2024
65,9495363,LA BAMBA,Bulk,3/21/2024,Canada,MAI,Vancouver (can),Initial,FALSE,17,"18416 LABOUR CONDITIONS-HEALTH PROTECTION, MEDICAL CARE,SOCIAL SECURITY (Ropes and wires) No 2 18...",Marine Ace Co Ltd (Marine Ace YK),JPN,,[redacted],[redacted],"F, N & S Building, 1-11, Nihonbashiningyo-cho 1-chome, Chuo-ku, Tokyo, 103-0013, Japan",1333924,6/7/2024
66,9354478,IDA RAMBOW,,6/6/2024,Norway,,Brevik,Initial,FALSE,2,"18324, Cold room, cold room cleanliness, cold room temperature, Labour conditions - Accommodation...",Rambow Reederei,,,[redacted],[redacted],", , Germany",5090029,6/7/2024
67,9972012,OCEAN CONDUCTOR,,6/6/2024,Belgium,,Antwerpen,Detailed,FALSE,3,"14804, Ballast Water Exchange, Pollution prevention - Ballast Water, 1011, Not as required,14802,...",Hakuyo Kisen KK,,,[redacted],[redacted],"236-8, Arouzu, Hakata-cho, Imabari, Japan",0216212,6/7/2024
68,9639646,SITC SHENZHEN,Cont,3/20/2024,Philippines,HKG,South Harbour Manila,Initial,FALSE,1,"13103; PROPULSION AND AUXILIARY MACHINERY (Gauges,thermometers, etc) No",SITC Shipping Management (Shanghai) Co Ltd,CHN,www.sitc.comhttp://www.sitc.com,[redacted],[redacted],"Building 30, 1388, Zhangdong Lu, Pudong Xinqu, Shanghai 201203, China",5559581,6/7/2024
69,9723954,GANT YRIA,,6/6/2024,United Kingdom,,Liverpool,Initial,FALSE,3,"11124, Embarkation arrangement survival craft, Life saving appliances, 1086, Not properly maintai...",Anthony Giavridis Maritime Inc,,,[redacted],[redacted],", , Greece",1918275,6/7/2024
70,9113721,CARIBE VOYAGER,Gen,5/31/2024,Cayman Islands,ABB,George Town,Initial,FALSE,9,"11113, 11117, 03108, 03103, 07109, 01308, 09124, 01215 Launching arrangement for rescue boats, Li...",Hyde Shipping Corp,USA,https://www.hydeshipping.com/,[redacted],[redacted],"Suite 2, 10025, NW 116th Way, Medley FL 33178-1197, USA.",0545411,6/7/2024
71,9579444,MING LIAN,Bulk,6/6/2024,Republic of Moldova,CHN,Nakhodka,Follow-up,FALSE,3,"1 18425 LABOUR CONDITIONS-HEALTH PROTECTION, MEDICAL CARE,SOCIAL SECURITY (Access / structural fe...",Fuzhou Hailing Shipping Co Ltd,CHN,,[redacted],[redacted],"Room 2103, Shida International Plaza, 216, Hudong Lu, Gulou Qu, Fuzhou, Fujian, 350003, China",5176753,6/7/2024
72,9309447,MSC RANIA,Cont,6/6/2024,China,PAN,Ningbo,Follow-up,FALSE,2,"1 18413 LABOUR CONDITIONS-HEALTH PROTECTION, MEDICAL CARE,SOCIAL SECURITY (Warning notices) (06.0...",MSC Shipmanagement Ltd,CYP,https://mscshipmanagement.com/,[redacted],[redacted],"MSC House, 8, Spyrou Kyprianou Avenue, Limassol, Cyprus",1535947,6/7/2024
73,9660592,MEDI YOKOHAMA,Bulk,6/7/2024,Japan,PAN,Niigata,Follow-up,FALSE,3,1 15106 ISM (Shipboard operations) (07.12.2023) No 2 10199 SAFETY OF NAVIGATION (Other (navigatio...,Misuga Ship Management Co Ltd,JPN,,[redacted],[redacted],"2-5, Fujimi 2-chome, Chiyoda-ku, Tokyo, 102-0071, Japan.",6297399,6/7/2024
74,9456410,XIANG CHENG SHAN,Bulk,6/7/2024,Russia,CHN,Vostochnyy,Follow-up,FALSE,2,1 14801 POLLUTION PREVENTION - BALLAST WATER (Ballast Water Management Plan) No 2 13199 PROPULSIO...,Safety Sailing Ship Management (Tianjin) Co Ltd,CHN,,[redacted],[redacted],"Building 1-2, Minghai Center, 7-407, Hulun Bei'er Lu, Dongjiang Port Free Trade Zone, Tianjin, 30...",6035894,6/7/2024
75,8653073,ORANGE LINK,Gen,6/7/2024,Russia,SIE,Vanino,Initial,FALSE,3,1 14611 POLLUTION PREVENTION - MARPOL ANNEX VI (Ozone-depleting substances) No 2 14802 POLLUTION ...,Orange Marine Co Ltd,RUS,,[redacted],[redacted],"Office 31, ul Bestuzheva 61, Vladivostok, Primorskiy kray, Russia.",5727981,6/7/2024
76,9934008,BAO RONG 7,Gen,6/5/2024,Japan,PAN,"Misumi, Kumamoto",Initial,FALSE,5,1 14610 POLLUTION PREVENTION - MARPOL ANNEX VI (Operational procedures for engines or equipment )...,Hosei Manning Co Ltd,CHN,,[redacted],[redacted],"Room 1007, Unit 1, 20, Gangwan Jie, Zhongshan Qu, Dalian, Liaoning, 116001, China",6294726,6/7/2024
77,9045168,WATER PHOENIX,Reef,6/6/2024,China,PAN,Rizhao,Initial,TRUE,13,1 14607 POLLUTION PREVENTION - MARPOL ANNEX VI (Quality of fuel oil ) Yes 2 03105 WATER/WEATHERTI...,Seatrade Groningen B.V.,NTH,http://www.seatrade.nl,[redacted],[redacted],"Leonard Springerlaan 17, 9727 KB Groningen, Netherlands",0280765,6/7/2024
78,9525637,HAI BINH 16,Gen,6/5/2024,Philippines,VNM,"Iloilo, Panay",Initial,FALSE,4,1 14502 POLLUTION PREVENTION - MARPOL ANNEX V (Placards) No 2 11104 LIFE SAVING APPLIANCES (Rescu...,TTC Ship Management Co Ltd,VNM,,[redacted],[redacted],"Office 101, TTC Building, 630, Le Thanh Tong, Hai An District, Haiphong City, Vietnam.",5794743,6/7/2024
79,9186431,PROVIDENT,Cont,6/6/2024,Russia,PAN,Nakhodka,Follow-up,FALSE,6,1 14501 POLLUTION PREVENTION - MARPOL ANNEX V (Garbage) No 2 14501 POLLUTION PREVENTION - MARPOL ...,Qingdao Foto International Shipping Management Co Ltd,CHN,,[redacted],[redacted],"Room 202, Building 21, 18, Taipingjiao Silu, Shinan Qu, Qingdao, Shandong, China",5243547,6/7/2024
80,9236561,RACHA BHUM,Cont,6/6/2024,Malaysia,SNG,Port Kelang,Initial,FALSE,1,1 14499 POLLUTION PREVENTION - MARPOL ANNEX IV (Other (MARPOL Annex IV)) No,RCL Shipmanagement Pte Ltd,SNG,,[redacted],[redacted],"08-00, ABI Plaza, 11, Keppel Road, Singapore 089057",1327130,6/7/2024
81,9142136,OCEANUS 09,LPG,6/7/2024,China,VNM,Humen,Initial,FALSE,3,"1 13103 PROPULSION AND AUXILIARY MACHINERY (Gauges,thermometers, etc) No 2 07103 FIRE SAFETY (Div...",Nhat Viet Transportation Corp (NV Trans Corp),VNM,,[redacted],[redacted],"151, Nguyen Van Thu, District 1, Ho Chi Minh City, Vietnam.",5486413,6/7/2024
82,9437256,BF CARP,Cont,6/6/2024,China,CYP,Xiamen,Initial,FALSE,2,"1 13103 PROPULSION AND AUXILIARY MACHINERY (Gauges,thermometers, etc) No 2 03105 WATER/WEATHERTIG...",BF Shipmanagement GmbH & Co KG,GER,http://www.foroohari.com/en/frontpage-2/,[redacted],[redacted],"An der Werft 2, 21680 Stade, Germany",5407574,6/7/2024
83,9771834,PANFILOVO,Gen,6/7/2024,Russia,CMN,Korsakov,Follow-up,FALSE,19,1 13102 PROPULSION AND AUXILIARY MACHINERY (Auxiliary engine) (08.04.2024) No 2 01340 CERTIFICATE...,Solution Marine Service Ltd,BZE,,[redacted],[redacted],"Belize City, Belize.",6382379,6/7/2024
84,9902550,GCL LEADER,Bulk,6/6/2024,China,LIB,Shenzhen,Initial,FALSE,2,1 11199 LIFE SAVING APPLIANCES (Other (life saving)) No 2 13102 PROPULSION AND AUXILIARY MACHINER...,Anglo-Eastern Ship Management Ltd,HKG,http://www.aesm.com.hk/,[redacted],[redacted],"23rd Floor, 248, Queen's Road East, Wan Chai, Hong Kong, China",0522961,6/7/2024
85,9650779,FRONTIER YOUTH,Bulk,6/6/2024,China,PAN,Yingkou,Follow-up,FALSE,2,1 11117 LIFE SAVING APPLIANCES (Lifebuoys incl. provision and disposition) No 2 07114 FIRE SAFETY...,Mizuho Sangyo Co Ltd,JPN,https://www.mizuho-ki.co.jp/en/,[redacted],[redacted],"4-32, Jibori 6-chome, Imabari-shi, Ehime-ken, 799-2117, Japan.",0250925,6/7/2024
86,8357930,BAO JIA 77,Gen,6/6/2024,China,PAN,Tangshan,Follow-up,FALSE,3,1 11117 LIFE SAVING APPLIANCES (Lifebuoys incl. provision and disposition) No 2 07113 FIRE SAFETY...,Haida Shipping Hongkong Co Ltd,HKG,,[redacted],[redacted],"Room 517, New City Centre, 2, Lei Yue Mun Road, Kwun Tong, Kowloon, Hong Kong, China",6336587,6/7/2024
87,9221449,DORIS,Gen,6/7/2024,Japan,CMN,Himeji,Initial,FALSE,8,1 11113 LIFE SAVING APPLIANCES (Launching arrangements for rescue boats) No 2 10109 SAFETY OF NAV...,SHENG ZE SHIPPING MANAGEMENT CO. LTD,HKG,,[redacted],[redacted],"Unit 1602, Beverley Commercial Centre, 87-105, Chatham Road South, Tsim Sha Tsui, Kowloon, Hong K...",6034998,6/7/2024
