title,provider,description,update_frequency,coverage,dimension,url,category,category_aws,platform,currency,price_mode,price,volume,size,data_sample
普兰票据数据库,上海普兰金融服务有限公司,普兰票据数据库是由普兰数据中心为票据市场参与者量身打造的专业数据库，内容包括：票据行情、统计数据和市场主体等，其中票据行情横跨纸票、电票两个时代的一二级市场数据，最早可追溯至2008年。,yearly,CN,500.0,https://nidts.chinadep.com/ep-hall/spec?id=3185,金融,Financial Services Data,Shanghai Data Exchange,RMB,negotiation,0.0,0,125829120.0,
普兰票据策略研报,上海普兰金融服务有限公司,普兰票据策略研报是2018年由普兰数据中心打造，针对票据市场全方位的研究分析与操作策略产品，内容主要有：当日行情回顾、市场分析和后市展望。,yearly,CN,10.0,https://nidts.chinadep.com/ep-hall/spec?id=3184,金融,Financial Services Data,Shanghai Data Exchange,RMB,negotiation,0.0,0,2097152000.0,
睿见投资交易（商办版）,仲量联行测量师事务所（上海）有限公司,企业在全国要开展存量资产收并购业务，需要进行资产价值研判，了解市场发展情况，从而做出决策是否要收并购，以及收购哪项资产。睿见投资交易（商办版）提供全国范围内办公楼宇的项目层面、市场层面、租户层面的数据及信息，助力企业了解资产的市场及运营情况，从而判断资产价值，为资产收购定价做市场依据,yearly,CN,300.0,https://nidts.chinadep.com/ep-hall/spec?id=3170,综合,"Retail, Location & Marketing Data",Shanghai Data Exchange,RMB,negotiation,0.0,0,53687091200.0,
睿见投资交易（产办版）,仲量联行测量师事务所（上海）有限公司,企业在全国要开展存量资产收并购业务，需要进行资产价值研判，了解市场发展情况，从而做出决策是否要收并购，以及收购哪项资产。睿见投资交易（产办版）提供产业园的项目层面、市场层面、租户层面的数据及信息，助力企业了解资产的市场及运营情况，从而判断资产价值，为资产收购定价做市场依据,yearly,CN,300.0,https://nidts.chinadep.com/ep-hall/spec?id=3169,综合,"Retail, Location & Marketing Data",Shanghai Data Exchange,RMB,negotiation,0.0,0,53687091200.0,
睿见项目改造,仲量联行测量师事务所（上海）有限公司,睿见项目改造帮助企业对自有存量项目盘活，提供详尽的城市/区域写字楼、产业园市场信息，包括周边竞品租金数据、空置率及经营数据等，同时可通过定制化服务帮助企业进行竞品深入调研，输出项目改造定位策划服务,yearly,CN,300.0,https://nidts.chinadep.com/ep-hall/spec?id=3168,综合,"Retail, Location & Marketing Data",Shanghai Data Exchange,RMB,negotiation,0.0,0,53687091200.0,
睿见租户信息（产办版）,仲量联行测量师事务所（上海）有限公司,睿见租户信息（产办版）提供详尽的产业园市场信息，包括周边竞品租金数据、空置率及经营数据等，同时可通过定制化服务帮助企业进行新租户深入调研，输出项目租户管理服务,yearly,CN,300.0,https://nidts.chinadep.com/ep-hall/spec?id=3167,综合,"Retail, Location & Marketing Data",Shanghai Data Exchange,RMB,negotiation,0.0,0,53687091200.0,
睿见租户信息（商办版）,仲量联行测量师事务所（上海）有限公司,睿见租户信息（商办版）提供详尽的城市/区域写字楼、产业园市场信息，包括周边竞品租金数据、空置率及经营数据等；同时可通过定制化服务帮助企业进行新租户深入调研，输出项目租户管理服务,yearly,CN,300.0,https://nidts.chinadep.com/ep-hall/spec?id=3166,综合,"Retail, Location & Marketing Data",Shanghai Data Exchange,RMB,negotiation,0.0,0,53687091200.0,
睿见企业选址（产办版）,仲量联行测量师事务所（上海）有限公司,帮助企业根据公司性质在城市中选择适合自己企业发展的区位，通过对比不同办公楼数据找到最适合企业的楼宇，睿见企业选址（产办版）覆盖 8 个重点城市产业园超 1000+项目数据，能够根据企业需求，帮助企业快速锁定项目,yearly,CN,300.0,https://nidts.chinadep.com/ep-hall/spec?id=3165,综合,"Retail, Location & Marketing Data",Shanghai Data Exchange,RMB,negotiation,0.0,0,53687091200.0,
睿见企业选址（商办版）,仲量联行测量师事务所（上海）有限公司,"帮助企业根据公司性质在城市中选择适合自己企业发展的区位，通过对比不同办公楼数据找到最适合企业的楼宇，睿见企业选址（商办版）覆盖全国 238 个城市，近 7,000 个项目市场数据，10 个重点城市 2,000+个项目租户数据，能够根据企业需求，帮助企业快速锁定子市场、锁定项目",yearly,CN,300.0,https://nidts.chinadep.com/ep-hall/spec?id=3164,综合,"Retail, Location & Marketing Data",Shanghai Data Exchange,RMB,negotiation,0.0,0,53687091200.0,
睿见商办行业研究,仲量联行测量师事务所（上海）有限公司,以“产业”为研究对象，研究产业内部各企业间相互作用关系、产业本身发展、产业间互动联系以及空间区域中的分布等，通过对城市下各商业办公项目租户数据的调研及分析，渗透产业结构、租户来源等数据，能够满足企业的特定产业的行业分析需求,yearly,CN,300.0,https://nidts.chinadep.com/ep-hall/spec?id=3163,综合,"Retail, Location & Marketing Data",Shanghai Data Exchange,RMB,negotiation,0.0,0,53687091200.0,
睿见产办行业研究,仲量联行测量师事务所（上海）有限公司,以“产业”为研究对象，研究产业内部各企业间相互作用关系、产业本身发展、产业间互动联系以及空间区域中的分布等，通过对城市下各产业园区项目租户数据的调研及分析，渗透产业结构、租户来源等数据，能够满足企业的特定产业的行业分析需求,yearly,CN,300.0,https://nidts.chinadep.com/ep-hall/spec?id=3162,综合,"Retail, Location & Marketing Data",Shanghai Data Exchange,RMB,negotiation,0.0,0,53687091200.0,
睿见市场监测（产办版）,仲量联行测量师事务所（上海）有限公司,运用科学方法系统地、定期地搜集、记录、整理有关产业园行业、市场的信息和资料，分析产业园行业市场情况，了解产业园行业市场的现状及其发展趋势，为产业园行业投资决策或营销决策提供客观、正确的资料。收录8个重点城市产业园超1000+项目数据，洞察产业园区市场赋能业主、开发商、投资者、运营商及企业租户,yearly,CN,300.0,https://nidts.chinadep.com/ep-hall/spec?id=3159,综合,"Retail, Location & Marketing Data",Shanghai Data Exchange,RMB,negotiation,0.0,0,53687091200.0,
睿见市场监测（商办版）,仲量联行测量师事务所（上海）有限公司,"运用科学方法系统定期地搜集、记录、整理有关办公楼行业、市场的信息和资料，分析办公楼行业市场情况，了解办公楼行业市场的现状及其发展趋势，为办公楼行业投资决策或营销决策提供客观、正确的资料。覆盖全国238个城市，收录7,000+个项目及4年历史数据，洞察全国办公楼市场，提供城市及子市场层面市场表现数据",yearly,CN,300.0,https://nidts.chinadep.com/ep-hall/spec?id=3158,综合,"Retail, Location & Marketing Data",Shanghai Data Exchange,RMB,negotiation,0.0,0,53687091200.0,
标准必要专利SEP,中国图书进出口（集团）有限公司,标准必要专利指实施某标准技术时不可规避的专利。本产品收录了15个标准制定组织（SSO）的专利权人声明的SEP，以人工智能+手动核对的方式标准化了权利人向上述SSO所声明的专利，检查了所有声明专利的申请和公开号，并通过家族信息对重复声明的专利（就同一个发明的多个家族成员向SSO多次声明）予以去重。,yearly,"AW,AF,AO,AI,AX,AL,AD,AE,AR,AM,AS,AQ,TF,AG,AU,AT,AZ,BI,BE,BJ,BQ,BF,BD,BG,BH,BS,BA,BL,BY,BZ,BM,BO,BR,BB,BN,BT,BV,BW,CF,CA,CC,CH,CL,CN,CI,CM,CD,CG,CK,CO,KM,CV,CR,CU,CW,CX,KY,CY,CZ,DE,DJ,DM,DK,DO,DZ,EC,EG,ER,EH,ES,EE,ET,FI,FJ,FK,FR,FO,FM,GA,GB,GE,GG,GH,GI,GN,GP,GM,GW,GQ,GR,GD,GL,GT,GF,GU,GY,HK,HM,HN,HR,HT,HU,ID,IM,IN,IO,IE,IR,IQ,IS,IL,IT,JM,JE,JO,JP,KZ,KE,KG,KH,KI,KN,KR,KW,LA,LB,LR,LY,LC,LI,LK,LS,LT,LU,LV,MO,MF,MA,MC,MD,MG,MV,MX,MH,MK,ML,MT,MM,ME,MN,MP,MZ,MR,MS,MQ,MU,MW,MY,YT,NA,NC,NE,NF,NG,NI,NU,NL,NO,NP,NR,NZ,OM,PK,PA,PN,PE,PH,PW,PG,PL,PR,KP,PT,PY,PS,PF,QA,RE,RO,RU,RW,SA,SD,SN,SG,GS,SH,SJ,SB,SL,SV,SM,SO,PM,RS,SS,ST,SR,SK,SI,SE,SZ,SX,SC,SY,TC,TD,TG,TH,TJ,TK,TM,TL,TO,TT,TN,TR,TV,TW,TZ,UG,UA,UM,UY,US,UZ,VA,VC,VE,VG,VI,VN,VU,WF,WS,YE,ZA,ZM,ZW",5.0,https://nidts.chinadep.com/ep-hall/spec?id=3062,国际,Financial Services Data,Shanghai Data Exchange,RMB,negotiation,0.0,0,2147483648.0,
铜加工产销量,浙江海亮股份有限公司,"提供包括铜管、铜板、铜棒等铜加工产品产销量的时间序列数据,涵盖了一整年中从1月到12月每个月的数据,数据为一定的区间或范围的形式。反映铜加工行业的生产能力和趋势,帮助了解铜制品的生产情况,反应市场需求和销售趋势。",monthly,CN,6.0,https://nidts.chinadep.com/ep-hall/spec?id=3060,金融,Financial Services Data,Shanghai Data Exchange,RMB,negotiation,0.0,0,10485760.0,
风险监控,天仪基业（上海）智能科技有限公司,实时监控企业司法、行政案件，企业董监高司法案件的新增及更新；有效帮助投资人及时获取预警信息，降低风险。,yearly,CN,45.0,https://nidts.chinadep.com/ep-hall/spec?id=3047,金融,Financial Services Data,Shanghai Data Exchange,RMB,negotiation,0.0,0,32985348833280.0,
标的搜索,天仪基业（上海）智能科技有限公司,针对项目众多，缺乏渠道寻觅合适标的的问题，通过行业、营业总收入、纳税额、员工人数、社保人数等多维度渠道帮助投资人找到合适标的，并对企业进行风险评估。企业风险评价报告数据模型结合了各行业专家策略及超过5000万企业信息数据源，深度查询企业风险信息，最大程度控制投资风险。,yearly,CN,60.0,https://nidts.chinadep.com/ep-hall/spec?id=3046,金融,Financial Services Data,Shanghai Data Exchange,RMB,negotiation,0.0,0,32985348833280.0,
查税票,天仪基业（上海）智能科技有限公司,在投资前、中、 后期通过查税票均可及时了解企业经营情况，判断企业经营是否正常，有无稳定业务流水。辅助用户投资决策。,yearly,CN,200.0,https://nidts.chinadep.com/ep-hall/spec?id=3045,金融,Financial Services Data,Shanghai Data Exchange,RMB,negotiation,0.0,0,32985348833280.0,
财务验真报告,天仪基业（上海）智能科技有限公司,"依托出资宝大数据模型，分析企业提供的财务材料是否与真实纳税申报材料一致,通过进销项发票数据对企业采购、销售、经营进行分析。",yearly,CN,200.0,https://nidts.chinadep.com/ep-hall/spec?id=3043,金融,Financial Services Data,Shanghai Data Exchange,RMB,negotiation,0.0,0,32985348833280.0,
个人风险评价报告,天仪基业（上海）智能科技有限公司,深度查询企业核心人员风险信息：不良信息、司法风险、其他借贷。多维度帮助投资人监管被投企业风险，实时预警，最大程度控制投资风险。,yearly,CN,40.0,https://nidts.chinadep.com/ep-hall/spec?id=3042,金融,Financial Services Data,Shanghai Data Exchange,RMB,negotiation,0.0,0,32985348833280.0,
临床诊疗知识库,同方知网数字出版技术股份有限公司,平台通过整合设计，关联知识点，验证基本症状体征，及时向医护人员提供信息反馈和提示，减少医疗差错的发生概率，辅助诊断与治疗，并提供相关临床文献扩展阅读。满足各级医疗机构、卫生从业人员的不同需求。,yearly,CN,67.0,https://nidts.chinadep.com/ep-hall/spec?id=3026,综合,Media & Entertainment Data,Shanghai Data Exchange,RMB,negotiation,0.0,0,3078632557772.8,
电力科创知识服务平台,同方知网数字出版技术股份有限公司,平台旨在建设电力机构信息化平台，全面、系统、准确、及时提供机构所需的情报、管理、技术等文献服务，运用先进的技术为电力用户打造电力知识服务平台。面向电力企业的决策、管理、技术创新的知识需求，提供学术资源、战略新闻、经营管理、技术情报、科研管理与决策等全方位知识服务。,yearly,CN,108.0,https://nidts.chinadep.com/ep-hall/spec?id=3027,综合,Media & Entertainment Data,Shanghai Data Exchange,RMB,negotiation,0.0,0,87960930222080.0,
中国金融知识仓库,同方知网数字出版技术股份有限公司,《中国金融知识仓库》是经国家新闻出版署批准的金融领域专业知识服务平台，收录了期刊、学位论文、专利、政策法规、报纸等知识资源，能够为金融从业人员及时获取政策资讯、高质量研究文献、权威专家观点、行业研究报告等情报知识，进行金融市场发展分析、研究、预测、产业投资风险评估等行业创新及研究活动提供有力支撑。,yearly,CN,108.0,https://nidts.chinadep.com/ep-hall/spec?id=3031,金融,Financial Services Data,Shanghai Data Exchange,RMB,negotiation,0.0,0,33864958135500.8,
机械制造知识资源总库,同方知网数字出版技术股份有限公司,平台涵盖机械零部件、机械材料、工程机械、重型机械、农业机械、石化机械、环保机械、电力设备、动力机械、智能制造设备、绿色制造等重点研究领域，满足机械制造相关从业人员的知识需求，深入剖析各类机械设备研发过程中涉及的技术难题和基础性、进阶性问题，全方位支撑机械制造企业、相关科研机构技术创新。,yearly,CN,108.0,https://nidts.chinadep.com/ep-hall/spec?id=3029,先进制造,Manufacturing Data,Shanghai Data Exchange,RMB,negotiation,0.0,0,71468255805440.0,
向日葵AI智慧大脑,重庆葵海数字科技有限公司,“向日葵AI智慧大脑”利用AI技术，参考银行反欺诈模型自研算法，结合平台大量标化的服务数据，实现对生命健康领域灵活用工的特定场景的分析和数据研判，为客户提供大健康领域的全价值链数字信息报告。该产品能够更加及时、客观的还原生命健康领域灵活用工模式在真实交易场景下的工作状态，推动大健康领域高质量发展。,yearly,CN,50.0,https://nidts.chinadep.com/ep-hall/spec?id=2948,金融,Financial Services Data,Shanghai Data Exchange,RMB,negotiation,0.0,0,1073741824000.0,
企业专利价值评估报告,辽宁卓信普惠征信服务有限公司,通过科技创新型企业主动授权和第三方优质数据源厂商，查询获取科技创新企业的概况、专利基本信息、专利法律状态、专利趋势、专利类型分布等多维度数据并形成分析报告，降低银行等金融机构对科技创新类客户服务的搜寻成本，减少业务流程中的信息不对称，为金融机构的贷款服务提供决策辅助服务，降低贷款损失的可能性。,real-time,CN,166.0,https://nidts.chinadep.com/ep-hall/spec?id=2940,金融,Financial Services Data,Shanghai Data Exchange,RMB,negotiation,0.0,0,10995116277760.0,
企业财税信息分析报告,辽宁卓信普惠征信服务有限公司,通过企业主体主动授权和第三方优质数据源厂商，查询获取企业的基本信息、资产负债表和利润表、纳税信用等级、完税和欠税信息、发票信息、涉税违法违章信息等多维度数据并形成分析报告，降低银行等金融机构对客户的搜寻成本，减少业务流程中的信息不对称，为金融机构的贷款服务提供决策辅助服务，降低贷款损失的可能性。,real-time,CN,300.0,https://nidts.chinadep.com/ep-hall/spec?id=2941,金融,Financial Services Data,Shanghai Data Exchange,RMB,negotiation,0.0,0,10995116277760.0,
企业风险信息排查报告,辽宁卓信普惠征信服务有限公司,通过企业主体主动授权和第三方优质数据源厂商，查询获取客户工商基本信息、股权质押信息、动产抵押信息、经营异常信息、违法失信、行政处罚、税务处罚、环保处罚等多维度数据并形成分析报告，降低银行等金融机构对客户信用情况甄别的信息搜寻和分析判断成本，为金融机构的贷款服务提供决策辅助服务，降低贷款损失的可能性。,daily,CN,546.0,https://nidts.chinadep.com/ep-hall/spec?id=2942,金融,Financial Services Data,Shanghai Data Exchange,RMB,negotiation,0.0,0,10995116277760.0,
企业经营数据分析报告,辽宁卓信普惠征信服务有限公司,通过客户主动授权和第三方优质数据源厂商，查询获取客户的基本工商信息、员工社保公积金、企业资产负债情况、企业招聘、企业失信被执行、企业行政处罚等信息并形成企业经营数据分析报告，为金融机构提供全面的企业状况分析信息。,real-time,CN,237.0,https://nidts.chinadep.com/ep-hall/spec?id=2943,金融,Financial Services Data,Shanghai Data Exchange,RMB,negotiation,0.0,0,10737418240.0,
电商贷辅助决策风险分析报告,辽宁卓信普惠征信服务有限公司,通过电商客户主动授权和第三方优质数据源厂商，查询获取电商客户的门店基本信息、商品数据、门店账单、门店流水等经营信息；同时结合工商、司法、涉诉、舆情等多维度数据，对电商客户进行全面的风险情况排查，为银行等金融机构的电商贷产品提供辅助风控，降低银行贷款决策风险。,real-time,CN,385.0,https://nidts.chinadep.com/ep-hall/spec?id=2944,金融,Financial Services Data,Shanghai Data Exchange,RMB,negotiation,0.0,0,10995116277760.0,
电商经营分析报告,辽宁卓信普惠征信服务有限公司,通过电商客户单体主动授权，可查询获取全国范围内电商客户的门店基本信息、订单信息、门店账单、商品数据等多项数据信息并形成电商经营情况统计分析报告，降低银行等金融机构对电商类客户信息搜寻成本，减少业务流程中的信息不对称，为金融机构的贷款服务提供信息辅助，解决银企之间信息不对称问题。,daily,CN,348.0,https://nidts.chinadep.com/ep-hall/spec?id=2945,金融,Financial Services Data,Shanghai Data Exchange,RMB,negotiation,0.0,0,10995116277760.0,
企业综合实力全景报告,辽宁卓信普惠征信服务有限公司,通过客户主动授权和第三方优质数据源厂商，查询获取客户的工商基本信息、经营信息、环保信息、财务报表信息、税务信息、司法信息等多维度数据并形成分析报告，降低银行等金融机构对客户的搜寻成本，减少业务流程中的信息不对称，为金融机构的贷款服务提供决策辅助服务，降低贷款损失的可能性。,real-time,CN,600.0,https://nidts.chinadep.com/ep-hall/spec?id=2946,金融,Financial Services Data,Shanghai Data Exchange,RMB,negotiation,0.0,0,10995116277760.0,
多语种双语对照平行语料,云南传思科技有限公司,包含100个语种、30个专业领域的海量双语平行语料，可直接用于人工智能自然语言处理的研发和应用、机器翻译引擎研发、大模型研发的训练数据、语音合成训练数据，也可以用作外语教学及研究的翻译记忆库，计算机辅助翻译（CAT）记忆库及高校各专业领域的外文教育教学和研究、大数据管理教育教学及研究等。,no-update,CN,3.0,https://nidts.chinadep.com/ep-hall/spec?id=2929,综合,Media & Entertainment Data,Shanghai Data Exchange,RMB,negotiation,0.0,0,104857600000.0,
营运车辆经营监测报告,北京菱云科技有限公司,营运车辆经营监测报告，可用于运输经营分析、运输质量管理、碳排放计算、车辆价值评估、企业融资及资产监管等方面。,monthly,CN,26.0,https://nidts.chinadep.com/ep-hall/spec?id=2947,金融,Financial Services Data,Shanghai Data Exchange,RMB,negotiation,0.0,0,2147483648.0,
工程信息数据集,中国图书进出口（集团）有限公司,"工程信息数据集（Engineering Sciences Data Unit,ESDU),主要向工程设计人员提供经验性数据处理方法，及设计问题解决方案，专业性较强，覆盖某特定工程领域，适合解决工程技术问题。数据信息以简练易懂的格式来表达，包括衍生、解释、参考、图表和示例，经验性公式和图表清晰明了。",yearly,"AW,AF,AO,AI,AX,AL,AD,AE,AR,AM,AS,AQ,TF,AG,AU,AT,AZ,BI,BE,BJ,BQ,BF,BD,BG,BH,BS,BA,BL,BY,BZ,BM,BO,BR,BB,BN,BT,BV,BW,CF,CA,CC,CH,CL,CN,CI,CM,CD,CG,CK,CO,KM,CV,CR,CU,CW,CX,KY,CY,CZ,DE,DJ,DM,DK,DO,DZ,EC,EG,ER,EH,ES,EE,ET,FI,FJ,FK,FR,FO,FM,GA,GB,GE,GG,GH,GI,GN,GP,GM,GW,GQ,GR,GD,GL,GT,GF,GU,GY,HK,HM,HN,HR,HT,HU,ID,IM,IN,IO,IE,IR,IQ,IS,IL,IT,JM,JE,JO,JP,KZ,KE,KG,KH,KI,KN,KR,KW,LA,LB,LR,LY,LC,LI,LK,LS,LT,LU,LV,MO,MF,MA,MC,MD,MG,MV,MX,MH,MK,ML,MT,MM,ME,MN,MP,MZ,MR,MS,MQ,MU,MW,MY,YT,NA,NC,NE,NF,NG,NI,NU,NL,NO,NP,NR,NZ,OM,PK,PA,PN,PE,PH,PW,PG,PL,PR,KP,PT,PY,PS,PF,QA,RE,RO,RU,RW,SA,SD,SN,SG,GS,SH,SJ,SB,SL,SV,SM,SO,PM,RS,SS,ST,SR,SK,SI,SE,SZ,SX,SC,SY,TC,TD,TG,TH,TJ,TK,TM,TL,TO,TT,TN,TR,TV,TW,TZ,UG,UA,UM,UY,US,UZ,VA,VC,VE,VG,VI,VN,VU,WF,WS,YE,ZA,ZM,ZW",50.0,https://nidts.chinadep.com/ep-hall/spec?id=2910,先进制造,Manufacturing Data,Shanghai Data Exchange,RMB,negotiation,0.0,0,107374182400.0,
国际标准数据库,中国图书进出口（集团）有限公司,国际标准数据库(Engineering Workbench(EWB))是行业知名标准管理解决方案，提供来自370多个标准开发组织和出版商的工程和技术参考文档，帮助企业降低不合规所产生的成本和风险，避免销售和市场份额的减损；更好支持研发和工程任务，缩短产品上市时间，而不是把时间浪费在搜索和研究标准。,yearly,"AW,AF,AO,AI,AX,AL,AD,AE,AR,AM,AS,AQ,TF,AG,AU,AT,AZ,BI,BE,BJ,BQ,BF,BD,BG,BH,BS,BA,BL,BY,BZ,BM,BO,BR,BB,BN,BT,BV,BW,CF,CA,CC,CH,CL,CN,CI,CM,CD,CG,CK,CO,KM,CV,CR,CU,CW,CX,KY,CY,CZ,DE,DJ,DM,DK,DO,DZ,EC,EG,ER,EH,ES,EE,ET,FI,FJ,FK,FR,FO,FM,GA,GB,GE,GG,GH,GI,GN,GP,GM,GW,GQ,GR,GD,GL,GT,GF,GU,GY,HK,HM,HN,HR,HT,HU,ID,IM,IN,IO,IE,IR,IQ,IS,IL,IT,JM,JE,JO,JP,KZ,KE,KG,KH,KI,KN,KR,KW,LA,LB,LR,LY,LC,LI,LK,LS,LT,LU,LV,MO,MF,MA,MC,MD,MG,MV,MX,MH,MK,ML,MT,MM,ME,MN,MP,MZ,MR,MS,MQ,MU,MW,MY,YT,NA,NC,NE,NF,NG,NI,NU,NL,NO,NP,NR,NZ,OM,PK,PA,PN,PE,PH,PW,PG,PL,PR,KP,PT,PY,PS,PF,QA,RE,RO,RU,RW,SA,SD,SN,SG,GS,SH,SJ,SB,SL,SV,SM,SO,PM,RS,SS,ST,SR,SK,SI,SE,SZ,SX,SC,SY,TC,TD,TG,TH,TJ,TK,TM,TL,TO,TT,TN,TR,TV,TW,TZ,UG,UA,UM,UY,US,UZ,VA,VC,VE,VG,VI,VN,VU,WF,WS,YE,ZA,ZM,ZW",50.0,https://nidts.chinadep.com/ep-hall/spec?id=2909,先进制造,Manufacturing Data,Shanghai Data Exchange,RMB,negotiation,0.0,0,10995116277760.0,
电子元器件数据库,中国图书进出口（集团）有限公司,电子元器件数据库(BOM Intelligence)，包含11亿元器件，7600+制造商，每天更新，提供权威电子元器件信息，掌控合规/环境、生命周期和供应链风险，类别包括集成电路，机电设备，射频/微波，光电，电阻电容和连接器等。元器件包括一套完整的从产品设计的尺寸到环境合规再到长期可用性的预估信息。,yearly,"AW,AF,AO,AI,AX,AL,AD,AE,AR,AM,AS,AQ,TF,AG,AU,AT,AZ,BI,BE,BJ,BQ,BF,BD,BG,BH,BS,BA,BL,BY,BZ,BM,BO,BR,BB,BN,BT,BV,BW,CF,CA,CC,CH,CL,CN,CI,CM,CD,CG,CK,CO,KM,CV,CR,CU,CW,CX,KY,CY,CZ,DE,DJ,DM,DK,DO,DZ,EC,EG,ER,EH,ES,EE,ET,FI,FJ,FK,FR,FO,FM,GA,GB,GE,GG,GH,GI,GN,GP,GM,GW,GQ,GR,GD,GL,GT,GF,GU,GY,HK,HM,HN,HR,HT,HU,ID,IM,IN,IO,IE,IR,IQ,IS,IL,IT,JM,JE,JO,JP,KZ,KE,KG,KH,KI,KN,KR,KW,LA,LB,LR,LY,LC,LI,LK,LS,LT,LU,LV,MO,MF,MA,MC,MD,MG,MV,MX,MH,MK,ML,MT,MM,ME,MN,MP,MZ,MR,MS,MQ,MU,MW,MY,YT,NA,NC,NE,NF,NG,NI,NU,NL,NO,NP,NR,NZ,OM,PK,PA,PN,PE,PH,PW,PG,PL,PR,KP,PT,PY,PS,PF,QA,RE,RO,RU,RW,SA,SD,SN,SG,GS,SH,SJ,SB,SL,SV,SM,SO,PM,RS,SS,ST,SR,SK,SI,SE,SZ,SX,SC,SY,TC,TD,TG,TH,TJ,TK,TM,TL,TO,TT,TN,TR,TV,TW,TZ,UG,UA,UM,UY,US,UZ,VA,VC,VE,VG,VI,VN,VU,WF,WS,YE,ZA,ZM,ZW",50.0,https://nidts.chinadep.com/ep-hall/spec?id=2911,先进制造,Manufacturing Data,Shanghai Data Exchange,RMB,negotiation,0.0,0,109951162777600.0,
宏图一号SAR数据,航天宏图信息技术股份有限公司,本系列数据为宏图一号X波段HH单极化雷达数据，包含1米分辨率滑动聚束数据、3米分辨率的条带数据、5m分辨率的TOPSAR数据以及3米分辨率干涉测绘数据。数据分为1-6级产品，用户可根据具体需求，查询对应成像模式及产品等级，实现数据研究、图像分析、地形测绘、地表形变监测、水体提取、舰船提取等应用。,yearly,"AW,AF,AO,AI,AX,AL,AD,AE,AR,AM,AS,AQ,TF,AG,AU,AT,AZ,BI,BE,BJ,BQ,BF,BD,BG,BH,BS,BA,BL,BY,BZ,BM,BO,BR,BB,BN,BT,BV,BW,CF,CA,CC,CH,CL,CN,CI,CM,CD,CG,CK,CO,KM,CV,CR,CU,CW,CX,KY,CY,CZ,DE,DJ,DM,DK,DO,DZ,EC,EG,ER,EH,ES,EE,ET,FI,FJ,FK,FR,FO,FM,GA,GB,GE,GG,GH,GI,GN,GP,GM,GW,GQ,GR,GD,GL,GT,GF,GU,GY,HK,HM,HN,HR,HT,HU,ID,IM,IN,IO,IE,IR,IQ,IS,IL,IT,JM,JE,JO,JP,KZ,KE,KG,KH,KI,KN,KR,KW,LA,LB,LR,LY,LC,LI,LK,LS,LT,LU,LV,MO,MF,MA,MC,MD,MG,MV,MX,MH,MK,ML,MT,MM,ME,MN,MP,MZ,MR,MS,MQ,MU,MW,MY,YT,NA,NC,NE,NF,NG,NI,NU,NL,NO,NP,NR,NZ,OM,PK,PA,PN,PE,PH,PW,PG,PL,PR,KP,PT,PY,PS,PF,QA,RE,RO,RU,RW,SA,SD,SN,SG,GS,SH,SJ,SB,SL,SV,SM,SO,PM,RS,SS,ST,SR,SK,SI,SE,SZ,SX,SC,SY,TC,TD,TG,TH,TJ,TK,TM,TL,TO,TT,TN,TR,TV,TW,TZ,UG,UA,UM,UY,US,UZ,VA,VC,VE,VG,VI,VN,VU,WF,WS,YE,ZA,ZM,ZW",65.0,https://nidts.chinadep.com/ep-hall/spec?id=4436,航运交通,Automotive Data,Shanghai Data Exchange,RMB,negotiation,0.0,0,0.0,
