title,description,price,category,update_frequency,url,category_aws,size,volume,price_mode,provider,coverage,currency,dimension,platform,data_sample
钢铁指数2011年度指数数据,钢铁指数2011年度指数数据,5000.0,工业制造,no-update,https://ditm.zjdex.com/data-service/product-details?id=1691346814385201154&displayPrice=5000.00%E5%85%83&productType=0,Manufacturing Data,0.0,0,one-off,,CN,RMB,0,Zhejiang Big Data Exchange,
钢铁指数2013年度指数数据,钢铁指数2013年度指数数据,5000.0,工业制造,no-update,https://ditm.zjdex.com/data-service/product-details?id=1691347592990629890&displayPrice=5000.00%E5%85%83&productType=0,Manufacturing Data,0.0,0,one-off,,CN,RMB,0,Zhejiang Big Data Exchange,
钢铁指数2014年度指数数据,钢铁指数2014年度指数数据,5000.0,工业制造,no-update,https://ditm.zjdex.com/data-service/product-details?id=1691347812033961986&displayPrice=5000.00%E5%85%83&productType=0,Manufacturing Data,0.0,0,one-off,,CN,RMB,0,Zhejiang Big Data Exchange,
钢铁指数2015年度指数数据,钢铁指数2015年度指数数据,5000.0,工业制造,no-update,https://ditm.zjdex.com/data-service/product-details?id=1691348049247019010&displayPrice=5000.00%E5%85%83&productType=0,Manufacturing Data,0.0,0,one-off,,CN,RMB,0,Zhejiang Big Data Exchange,
钢铁指数2016年度指数数据,钢铁指数2016年度指数数据,5000.0,工业制造,no-update,https://ditm.zjdex.com/data-service/product-details?id=1691348267262746625&displayPrice=5000.00%E5%85%83&productType=0,Manufacturing Data,0.0,0,one-off,,CN,RMB,0,Zhejiang Big Data Exchange,
钢铁指数2019年度指数数据,钢铁指数2019年度指数数据,5000.0,工业制造,no-update,https://ditm.zjdex.com/data-service/product-details?id=1691349156484554753&displayPrice=5000.00%E5%85%83&productType=0,Manufacturing Data,0.0,0,one-off,,CN,RMB,0,Zhejiang Big Data Exchange,
钢铁指数2020年度指数数据,钢铁指数2020年度指数数据,5000.0,工业制造,no-update,https://ditm.zjdex.com/data-service/product-details?id=1691349379592167426&displayPrice=5000.00%E5%85%83&productType=0,Manufacturing Data,0.0,0,one-off,,CN,RMB,0,Zhejiang Big Data Exchange,
钢铁指数2021年度指数数据,钢铁指数2021年度指数数据,5000.0,工业制造,no-update,https://ditm.zjdex.com/data-service/product-details?id=1691349591941390337&displayPrice=5000.00%E5%85%83&productType=0,Manufacturing Data,0.0,0,one-off,,CN,RMB,0,Zhejiang Big Data Exchange,
化工指数2014年度指数数据,化工指数2014年度指数数据,5000.0,工业制造,no-update,https://ditm.zjdex.com/data-service/product-details?id=1691351196979896321&displayPrice=5000.00%E5%85%83&productType=0,Manufacturing Data,0.0,0,one-off,,CN,RMB,0,Zhejiang Big Data Exchange,
化工指数2018年度指数数据,化工指数2018年度指数数据,5000.0,工业制造,no-update,https://ditm.zjdex.com/data-service/product-details?id=1691352409918087169&displayPrice=5000.00%E5%85%83&productType=0,Manufacturing Data,0.0,0,one-off,,CN,RMB,0,Zhejiang Big Data Exchange,
建材指数2012年度指数数据,建材指数2012年度指数数据,5000.0,工业制造,no-update,https://ditm.zjdex.com/data-service/product-details?id=1691356485179351041&displayPrice=5000.00%E5%85%83&productType=0,Manufacturing Data,0.0,0,one-off,,CN,RMB,0,Zhejiang Big Data Exchange,
建材指数2013年度指数数据,建材指数2013年度指数数据,5000.0,工业制造,no-update,https://ditm.zjdex.com/data-service/product-details?id=1691356702985363457&displayPrice=5000.00%E5%85%83&productType=0,Manufacturing Data,0.0,0,one-off,,CN,RMB,0,Zhejiang Big Data Exchange,
建材指数2014年度指数数据,建材指数2014年度指数数据,5000.0,工业制造,no-update,https://ditm.zjdex.com/data-service/product-details?id=1691356925988118530&displayPrice=5000.00%E5%85%83&productType=0,Manufacturing Data,0.0,0,one-off,,CN,RMB,0,Zhejiang Big Data Exchange,
建材指数2016年度指数数据,建材指数2016年度指数数据,5000.0,工业制造,no-update,https://ditm.zjdex.com/data-service/product-details?id=1691357385423790081&displayPrice=5000.00%E5%85%83&productType=0,Manufacturing Data,0.0,0,one-off,,CN,RMB,0,Zhejiang Big Data Exchange,
建材指数2017年度指数数据,建材指数2017年度指数数据,5000.0,工业制造,no-update,https://ditm.zjdex.com/data-service/product-details?id=1691357609567395842&displayPrice=5000.00%E5%85%83&productType=0,Manufacturing Data,0.0,0,one-off,,CN,RMB,0,Zhejiang Big Data Exchange,
建材指数2018年度指数数据,建材指数2018年度指数数据,5000.0,工业制造,no-update,https://ditm.zjdex.com/data-service/product-details?id=1691357813548982274&displayPrice=5000.00%E5%85%83&productType=0,Manufacturing Data,0.0,0,one-off,,CN,RMB,0,Zhejiang Big Data Exchange,
建材指数2021年度指数数据,建材指数2021年度指数数据,5000.0,工业制造,no-update,https://ditm.zjdex.com/data-service/product-details?id=1691358527906062338&displayPrice=5000.00%E5%85%83&productType=0,Manufacturing Data,0.0,0,one-off,,CN,RMB,0,Zhejiang Big Data Exchange,
能源指数2022年度指数数据,能源指数2022年度指数数据,5000.0,工业制造,no-update,https://ditm.zjdex.com/data-service/product-details?id=1691380464799653889&displayPrice=5000.00%E5%85%83&productType=0,Manufacturing Data,0.0,0,one-off,,CN,RMB,0,Zhejiang Big Data Exchange,
农副指数2011年度指数数据,农副指数2011年度指数数据,5000.0,工业制造,no-update,https://ditm.zjdex.com/data-service/product-details?id=1691611964828753921&displayPrice=5000.00%E5%85%83&productType=0,Manufacturing Data,0.0,0,one-off,,CN,RMB,0,Zhejiang Big Data Exchange,
农副指数2013年度指数数据,农副指数2013年度指数数据,5000.0,工业制造,no-update,https://ditm.zjdex.com/data-service/product-details?id=1691612405868208130&displayPrice=5000.00%E5%85%83&productType=0,Manufacturing Data,0.0,0,one-off,,CN,RMB,0,Zhejiang Big Data Exchange,
农副指数2014年度指数数据,农副指数2014年度指数数据,5000.0,工业制造,no-update,https://ditm.zjdex.com/data-service/product-details?id=1691612648890376193&displayPrice=5000.00%E5%85%83&productType=0,Manufacturing Data,0.0,0,one-off,,CN,RMB,0,Zhejiang Big Data Exchange,
农副指数2015年度指数数据,农副指数2015年度指数数据,5000.0,工业制造,no-update,https://ditm.zjdex.com/data-service/product-details?id=1691612906043154434&displayPrice=5000.00%E5%85%83&productType=0,Manufacturing Data,0.0,0,one-off,,CN,RMB,0,Zhejiang Big Data Exchange,
农副指数2016年度指数数据,农副指数2016年度指数数据,5000.0,工业制造,no-update,https://ditm.zjdex.com/data-service/product-details?id=1691613338027106306&displayPrice=5000.00%E5%85%83&productType=0,Manufacturing Data,0.0,0,one-off,,CN,RMB,0,Zhejiang Big Data Exchange,
农副指数2018年度指数数据,农副指数2018年度指数数据,5000.0,工业制造,no-update,https://ditm.zjdex.com/data-service/product-details?id=1691613819239604226&displayPrice=5000.00%E5%85%83&productType=0,Manufacturing Data,0.0,0,one-off,,CN,RMB,0,Zhejiang Big Data Exchange,
农副指数2019年度指数数据,农副指数2019年度指数数据,5000.0,工业制造,no-update,https://ditm.zjdex.com/data-service/product-details?id=1691614154498711554&displayPrice=5000.00%E5%85%83&productType=0,Manufacturing Data,0.0,0,one-off,,CN,RMB,0,Zhejiang Big Data Exchange,
橡塑指数2012年度指数数据,橡塑指数2012年度指数数据,5000.0,工业制造,no-update,https://ditm.zjdex.com/data-service/product-details?id=1691615671255506945&displayPrice=5000.00%E5%85%83&productType=0,Manufacturing Data,0.0,0,one-off,,CN,RMB,0,Zhejiang Big Data Exchange,
橡塑指数2017年度指数数据,橡塑指数2017年度指数数据,5000.0,工业制造,no-update,https://ditm.zjdex.com/data-service/product-details?id=1691618959241715714&displayPrice=5000.00%E5%85%83&productType=0,Manufacturing Data,0.0,0,one-off,,CN,RMB,0,Zhejiang Big Data Exchange,
橡塑指数2018年度指数数据,橡塑指数2018年度指数数据,5000.0,工业制造,no-update,https://ditm.zjdex.com/data-service/product-details?id=1691619214947459074&displayPrice=5000.00%E5%85%83&productType=0,Manufacturing Data,0.0,0,one-off,,CN,RMB,0,Zhejiang Big Data Exchange,
橡塑指数2019年度指数数据,橡塑指数2019年度指数数据,5000.0,工业制造,no-update,https://ditm.zjdex.com/data-service/product-details?id=1691619420099256321&displayPrice=5000.00%E5%85%83&productType=0,Manufacturing Data,0.0,0,one-off,,CN,RMB,0,Zhejiang Big Data Exchange,
橡塑指数2020年度指数数据,橡塑指数2020年度指数数据,5000.0,工业制造,no-update,https://ditm.zjdex.com/data-service/product-details?id=1691619614840791041&displayPrice=5000.00%E5%85%83&productType=0,Manufacturing Data,0.0,0,one-off,,CN,RMB,0,Zhejiang Big Data Exchange,
有色指数2018年度指数数据,有色指数2018年度指数数据,5000.0,工业制造,no-update,https://ditm.zjdex.com/data-service/product-details?id=1691627869679853570&displayPrice=5000.00%E5%85%83&productType=0,Manufacturing Data,0.0,0,one-off,,CN,RMB,0,Zhejiang Big Data Exchange,
有色指数2019年度指数数据,有色指数2019年度指数数据,5000.0,工业制造,no-update,https://ditm.zjdex.com/data-service/product-details?id=1691628087087407106&displayPrice=5000.00%E5%85%83&productType=0,Manufacturing Data,0.0,0,one-off,,CN,RMB,0,Zhejiang Big Data Exchange,
有色指数2021年度指数数据,有色指数2021年度指数数据,5000.0,工业制造,no-update,https://ditm.zjdex.com/data-service/product-details?id=1691628631591952386&displayPrice=5000.00%E5%85%83&productType=0,Manufacturing Data,0.0,0,one-off,,CN,RMB,0,Zhejiang Big Data Exchange,
稀土指数2011年度指数数据,稀土指数2011年度指数数据,5000.0,工业制造,no-update,https://ditm.zjdex.com/data-service/product-details?id=1691713341324206081&displayPrice=5000.00%E5%85%83&productType=0,Manufacturing Data,0.0,0,one-off,,CN,RMB,0,Zhejiang Big Data Exchange,
稀土指数2012年度指数数据,稀土指数2012年度指数数据,5000.0,工业制造,no-update,https://ditm.zjdex.com/data-service/product-details?id=1691716021564153858&displayPrice=5000.00%E5%85%83&productType=0,Manufacturing Data,0.0,0,one-off,,CN,RMB,0,Zhejiang Big Data Exchange,
稀土指数2020年度指数数据,稀土指数2020年度指数数据,5000.0,工业制造,no-update,https://ditm.zjdex.com/data-service/product-details?id=1691721544137121793&displayPrice=5000.00%E5%85%83&productType=0,Manufacturing Data,0.0,0,one-off,,CN,RMB,0,Zhejiang Big Data Exchange,
氟化工指数2014年度指数数据,氟化工指数2014年度指数数据,5000.0,工业制造,no-update,https://ditm.zjdex.com/data-service/product-details?id=1691995876402864129&displayPrice=5000.00%E5%85%83&productType=0,Manufacturing Data,0.0,0,one-off,,CN,RMB,0,Zhejiang Big Data Exchange,
氟化工指数2015年度指数数据,氟化工指数2015年度指数数据,5000.0,工业制造,no-update,https://ditm.zjdex.com/data-service/product-details?id=1691996263667146753&displayPrice=5000.00%E5%85%83&productType=0,Manufacturing Data,0.0,0,one-off,,CN,RMB,0,Zhejiang Big Data Exchange,
氟化工指数2021年度指数数据,氟化工指数2021年度指数数据,5000.0,工业制造,no-update,https://ditm.zjdex.com/data-service/product-details?id=1692000355500105729&displayPrice=5000.00%E5%85%83&productType=0,Manufacturing Data,0.0,0,one-off,,CN,RMB,0,Zhejiang Big Data Exchange,
氟化工指数2022年度行情数据,氟化工指数2022年度行情数据,5000.0,工业制造,no-update,https://ditm.zjdex.com/data-service/product-details?id=1692000562132492289&displayPrice=5000.00%E5%85%83&productType=0,Manufacturing Data,0.0,0,one-off,,CN,RMB,0,Zhejiang Big Data Exchange,
甲醇产业指数2011年度指数数据,甲醇产业指数2011年度指数数据,5000.0,工业制造,no-update,https://ditm.zjdex.com/data-service/product-details?id=1692001444597276674&displayPrice=5000.00%E5%85%83&productType=0,Manufacturing Data,0.0,0,one-off,,CN,RMB,0,Zhejiang Big Data Exchange,
甲醇产业指数2013年度指数数据,甲醇产业指数2013年度指数数据,5000.0,工业制造,no-update,https://ditm.zjdex.com/data-service/product-details?id=1692002255700172801&displayPrice=5000.00%E5%85%83&productType=0,Manufacturing Data,0.0,0,one-off,,CN,RMB,0,Zhejiang Big Data Exchange,
甲醇产业指数2017年度指数数据,甲醇产业指数2017年度指数数据,5000.0,工业制造,no-update,https://ditm.zjdex.com/data-service/product-details?id=1692003801133424641&displayPrice=5000.00%E5%85%83&productType=0,Manufacturing Data,0.0,0,one-off,,CN,RMB,0,Zhejiang Big Data Exchange,
甲醇产业指数2018年度指数数据,甲醇产业指数2018年度指数数据,5000.0,工业制造,no-update,https://ditm.zjdex.com/data-service/product-details?id=1692004198594060289&displayPrice=5000.00%E5%85%83&productType=0,Manufacturing Data,0.0,0,one-off,,CN,RMB,0,Zhejiang Big Data Exchange,
氯碱指数2011年度指数数据,氯碱指数2011年度指数数据,5000.0,工业制造,no-update,https://ditm.zjdex.com/data-service/product-details?id=1692008666693836801&displayPrice=5000.00%E5%85%83&productType=0,Manufacturing Data,0.0,0,one-off,,CN,RMB,0,Zhejiang Big Data Exchange,
氯碱指数2012年度指数数据,氯碱指数2012年度指数数据,5000.0,工业制造,no-update,https://ditm.zjdex.com/data-service/product-details?id=1692009102561714178&displayPrice=5000.00%E5%85%83&productType=0,Manufacturing Data,0.0,0,one-off,,CN,RMB,0,Zhejiang Big Data Exchange,
氯碱指数2013年度指数数据,氯碱指数2013年度指数数据,5000.0,工业制造,no-update,https://ditm.zjdex.com/data-service/product-details?id=1692009511191781377&displayPrice=5000.00%E5%85%83&productType=0,Manufacturing Data,0.0,0,one-off,,CN,RMB,0,Zhejiang Big Data Exchange,
氯碱指数2014年度指数数据,氯碱指数2014年度指数数据,5000.0,工业制造,no-update,https://ditm.zjdex.com/data-service/product-details?id=1692009947667832834&displayPrice=5000.00%E5%85%83&productType=0,Manufacturing Data,0.0,0,one-off,,CN,RMB,0,Zhejiang Big Data Exchange,
氯碱指数2015年度指数数据,氯碱指数2015年度指数数据,5000.0,工业制造,no-update,https://ditm.zjdex.com/data-service/product-details?id=1692010317991321602&displayPrice=5000.00%E5%85%83&productType=0,Manufacturing Data,0.0,0,one-off,,CN,RMB,0,Zhejiang Big Data Exchange,
氯碱指数2018年度指数数据,氯碱指数2018年度指数数据,5000.0,工业制造,no-update,https://ditm.zjdex.com/data-service/product-details?id=1692011548524617729&displayPrice=5000.00%E5%85%83&productType=0,Manufacturing Data,0.0,0,one-off,,CN,RMB,0,Zhejiang Big Data Exchange,
氯碱指数2022年度行情数据,氯碱指数2022年度行情数据,5000.0,工业制造,no-update,https://ditm.zjdex.com/data-service/product-details?id=1692012927280422913&displayPrice=5000.00%E5%85%83&productType=0,Manufacturing Data,0.0,0,one-off,,CN,RMB,0,Zhejiang Big Data Exchange,
丙烷2014年度产业链指数数据,丙烷2014年度产业链指数数据,5000.0,工业制造,no-update,https://ditm.zjdex.com/data-service/product-details?id=1692362517892505601&displayPrice=5000.00%E5%85%83&productType=0,Manufacturing Data,0.0,0,one-off,,CN,RMB,0,Zhejiang Big Data Exchange,
丙烷2016年度产业链指数数据,丙烷2016年度产业链指数数据,5000.0,工业制造,no-update,https://ditm.zjdex.com/data-service/product-details?id=1692363269226569729&displayPrice=5000.00%E5%85%83&productType=0,Manufacturing Data,0.0,0,one-off,,CN,RMB,0,Zhejiang Big Data Exchange,
丙烷2018年度产业链指数数据,丙烷2018年度产业链指数数据,5000.0,工业制造,no-update,https://ditm.zjdex.com/data-service/product-details?id=1692364082674081793&displayPrice=5000.00%E5%85%83&productType=0,Manufacturing Data,0.0,0,one-off,,CN,RMB,0,Zhejiang Big Data Exchange,
丙烷2019年度产业链指数数据,丙烷2019年度产业链指数数据,5000.0,工业制造,no-update,https://ditm.zjdex.com/data-service/product-details?id=1692364456747278338&displayPrice=5000.00%E5%85%83&productType=0,Manufacturing Data,0.0,0,one-off,,CN,RMB,0,Zhejiang Big Data Exchange,
丙烷2020年度产业链指数数据,丙烷2020年度产业链指数数据,5000.0,工业制造,no-update,https://ditm.zjdex.com/data-service/product-details?id=1692364858242834434&displayPrice=5000.00%E5%85%83&productType=0,Manufacturing Data,0.0,0,one-off,,CN,RMB,0,Zhejiang Big Data Exchange,
丙烷2021年度产业链行情数据,丙烷2021年度产业链行情数据,5000.0,工业制造,no-update,https://ditm.zjdex.com/data-service/product-details?id=1692365037331226625&displayPrice=5000.00%E5%85%83&productType=0,Manufacturing Data,0.0,0,one-off,,CN,RMB,0,Zhejiang Big Data Exchange,
丙烷2021年度产业链指数数据,丙烷2021年度产业链指数数据,5000.0,工业制造,no-update,https://ditm.zjdex.com/data-service/product-details?id=1692365273583788034&displayPrice=5000.00%E5%85%83&productType=0,Manufacturing Data,0.0,0,one-off,,CN,RMB,0,Zhejiang Big Data Exchange,
丙烷2022年度产业链行情数据,丙烷2022年度产业链行情数据,5000.0,工业制造,no-update,https://ditm.zjdex.com/data-service/product-details?id=1692365447769038850&displayPrice=5000.00%E5%85%83&productType=0,Manufacturing Data,0.0,0,one-off,,CN,RMB,0,Zhejiang Big Data Exchange,
丙烷2022年度产业链指数数据,丙烷2022年度产业链指数数据,5000.0,工业制造,no-update,https://ditm.zjdex.com/data-service/product-details?id=1692365656611823617&displayPrice=5000.00%E5%85%83&productType=0,Manufacturing Data,0.0,0,one-off,,CN,RMB,0,Zhejiang Big Data Exchange,
苯乙烯2017年度产业链指数数据,苯乙烯2017年度产业链指数数据,5000.0,工业制造,no-update,https://ditm.zjdex.com/data-service/product-details?id=1692375622638837762&displayPrice=5000.00%E5%85%83&productType=0,Manufacturing Data,0.0,0,one-off,,CN,RMB,0,Zhejiang Big Data Exchange,
苯乙烯2018年度产业链指数数据,苯乙烯2018年度产业链指数数据,5000.0,工业制造,no-update,https://ditm.zjdex.com/data-service/product-details?id=1692375975744708610&displayPrice=5000.00%E5%85%83&productType=0,Manufacturing Data,0.0,0,one-off,,CN,RMB,0,Zhejiang Big Data Exchange,
苯乙烯2019年度产业链指数数据,苯乙烯2019年度产业链指数数据,5000.0,工业制造,no-update,https://ditm.zjdex.com/data-service/product-details?id=1692376351541764097&displayPrice=5000.00%E5%85%83&productType=0,Manufacturing Data,0.0,0,one-off,,CN,RMB,0,Zhejiang Big Data Exchange,
苯乙烯2020年度产业链指数数据,苯乙烯2020年度产业链指数数据,5000.0,工业制造,no-update,https://ditm.zjdex.com/data-service/product-details?id=1692376716630761474&displayPrice=5000.00%E5%85%83&productType=0,Manufacturing Data,0.0,0,one-off,,CN,RMB,0,Zhejiang Big Data Exchange,
苯乙烯2021年度产业链指数数据,苯乙烯2021年度产业链指数数据,5000.0,工业制造,no-update,https://ditm.zjdex.com/data-service/product-details?id=1692377074358755330&displayPrice=5000.00%E5%85%83&productType=0,Manufacturing Data,0.0,0,one-off,,CN,RMB,0,Zhejiang Big Data Exchange,
苯乙烯2022年度产业链指数数据,苯乙烯2022年度产业链指数数据,5000.0,工业制造,no-update,https://ditm.zjdex.com/data-service/product-details?id=1692377442849333250&displayPrice=5000.00%E5%85%83&productType=0,Manufacturing Data,0.0,0,one-off,,CN,RMB,0,Zhejiang Big Data Exchange,
冰晶石2013年度产业链指数数据,冰晶石2013年度产业链指数数据,5000.0,工业制造,no-update,https://ditm.zjdex.com/data-service/product-details?id=1692425519526256641&displayPrice=5000.00%E5%85%83&productType=0,Manufacturing Data,0.0,0,one-off,,CN,RMB,0,Zhejiang Big Data Exchange,
冰晶石2014年度产业链指数数据,冰晶石2014年度产业链指数数据,5000.0,工业制造,no-update,https://ditm.zjdex.com/data-service/product-details?id=1692425922951192578&displayPrice=5000.00%E5%85%83&productType=0,Manufacturing Data,0.0,0,one-off,,CN,RMB,0,Zhejiang Big Data Exchange,
冰晶石2015年度产业链指数数据,冰晶石2015年度产业链指数数据,5000.0,工业制造,no-update,https://ditm.zjdex.com/data-service/product-details?id=1692426685991559169&displayPrice=5000.00%E5%85%83&productType=0,Manufacturing Data,0.0,0,one-off,,CN,RMB,0,Zhejiang Big Data Exchange,
冰晶石2016年度产业链指数数据,冰晶石2016年度产业链指数数据,5000.0,工业制造,no-update,https://ditm.zjdex.com/data-service/product-details?id=1692427088372113409&displayPrice=5000.00%E5%85%83&productType=0,Manufacturing Data,0.0,0,one-off,,CN,RMB,0,Zhejiang Big Data Exchange,
冰晶石2017年度产业链指数数据,冰晶石2017年度产业链指数数据,5000.0,工业制造,no-update,https://ditm.zjdex.com/data-service/product-details?id=1692429752195555330&displayPrice=5000.00%E5%85%83&productType=0,Manufacturing Data,0.0,0,one-off,,CN,RMB,0,Zhejiang Big Data Exchange,
冰晶石2018年度产业链指数数据,冰晶石2018年度产业链指数数据,5000.0,工业制造,no-update,https://ditm.zjdex.com/data-service/product-details?id=1692430155956035585&displayPrice=5000.00%E5%85%83&productType=0,Manufacturing Data,0.0,0,one-off,,CN,RMB,0,Zhejiang Big Data Exchange,
冰晶石2019年度产业链指数数据,冰晶石2019年度产业链指数数据,5000.0,工业制造,no-update,https://ditm.zjdex.com/data-service/product-details?id=1692430710594019329&displayPrice=5000.00%E5%85%83&productType=0,Manufacturing Data,0.0,0,one-off,,CN,RMB,0,Zhejiang Big Data Exchange,
冰晶石2020年度产业链指数数据,冰晶石2020年度产业链指数数据,5000.0,工业制造,no-update,https://ditm.zjdex.com/data-service/product-details?id=1692431242507264001&displayPrice=5000.00%E5%85%83&productType=0,Manufacturing Data,0.0,0,one-off,,CN,RMB,0,Zhejiang Big Data Exchange,
冰晶石2021年度产业链行情数据,冰晶石2021年度产业链行情数据,5000.0,工业制造,no-update,https://ditm.zjdex.com/data-service/product-details?id=1692431437043277825&displayPrice=5000.00%E5%85%83&productType=0,Manufacturing Data,0.0,0,one-off,,CN,RMB,0,Zhejiang Big Data Exchange,
冰晶石2021年度产业链指数数据,冰晶石2021年度产业链指数数据,5000.0,工业制造,no-update,https://ditm.zjdex.com/data-service/product-details?id=1692431653091876866&displayPrice=5000.00%E5%85%83&productType=0,Manufacturing Data,0.0,0,one-off,,CN,RMB,0,Zhejiang Big Data Exchange,
冰晶石2022年度产业链行情数据,冰晶石2022年度产业链行情数据,5000.0,工业制造,no-update,https://ditm.zjdex.com/data-service/product-details?id=1692431836722700289&displayPrice=5000.00%E5%85%83&productType=0,Manufacturing Data,0.0,0,one-off,,CN,RMB,0,Zhejiang Big Data Exchange,
冰晶石2022年度产业链指数数据,冰晶石2022年度产业链指数数据,5000.0,工业制造,no-update,https://ditm.zjdex.com/data-service/product-details?id=1692432022861717505&displayPrice=5000.00%E5%85%83&productType=0,Manufacturing Data,0.0,0,one-off,,CN,RMB,0,Zhejiang Big Data Exchange,
丙酮2012年度产业链指数数据,丙酮2012年度产业链指数数据,5000.0,工业制造,no-update,https://ditm.zjdex.com/data-service/product-details?id=1692435900055363585&displayPrice=5000.00%E5%85%83&productType=0,Manufacturing Data,0.0,0,one-off,,CN,RMB,0,Zhejiang Big Data Exchange,
丙酮2013年度产业链指数数据,丙酮2013年度产业链指数数据,5000.0,工业制造,no-update,https://ditm.zjdex.com/data-service/product-details?id=1692437757800685569&displayPrice=5000.00%E5%85%83&productType=0,Manufacturing Data,0.0,0,one-off,,CN,RMB,0,Zhejiang Big Data Exchange,
丙酮2014年度产业链指数数据,丙酮2014年度产业链指数数据,5000.0,工业制造,no-update,https://ditm.zjdex.com/data-service/product-details?id=1692438269539328002&displayPrice=5000.00%E5%85%83&productType=0,Manufacturing Data,0.0,0,one-off,,CN,RMB,0,Zhejiang Big Data Exchange,
丙酮2015年度产业链指数数据,丙酮2015年度产业链指数数据,5000.0,工业制造,no-update,https://ditm.zjdex.com/data-service/product-details?id=1692438703217778690&displayPrice=5000.00%E5%85%83&productType=0,Manufacturing Data,0.0,0,one-off,,CN,RMB,0,Zhejiang Big Data Exchange,
丙酮2016年度产业链指数数据,丙酮2016年度产业链指数数据,5000.0,工业制造,no-update,https://ditm.zjdex.com/data-service/product-details?id=1692439173583806465&displayPrice=5000.00%E5%85%83&productType=0,Manufacturing Data,0.0,0,one-off,,CN,RMB,0,Zhejiang Big Data Exchange,
丙酮2017年度产业链指数数据,丙酮2017年度产业链指数数据,5000.0,工业制造,no-update,https://ditm.zjdex.com/data-service/product-details?id=1692439720990810113&displayPrice=5000.00%E5%85%83&productType=0,Manufacturing Data,0.0,0,one-off,,CN,RMB,0,Zhejiang Big Data Exchange,
丙酮2018年度产业链指数数据,丙酮2018年度产业链指数数据,5000.0,工业制造,no-update,https://ditm.zjdex.com/data-service/product-details?id=1692440223632007170&displayPrice=5000.00%E5%85%83&productType=0,Manufacturing Data,0.0,0,one-off,,CN,RMB,0,Zhejiang Big Data Exchange,
丙酮2019年度产业链指数数据,丙酮2019年度产业链指数数据,5000.0,工业制造,no-update,https://ditm.zjdex.com/data-service/product-details?id=1692441596473843714&displayPrice=5000.00%E5%85%83&productType=0,Manufacturing Data,0.0,0,one-off,,CN,RMB,0,Zhejiang Big Data Exchange,
丙酮2022年度产业链行情数据,丙酮2022年度产业链行情数据,5000.0,工业制造,no-update,https://ditm.zjdex.com/data-service/product-details?id=1692442506633617410&displayPrice=5000.00%E5%85%83&productType=0,Manufacturing Data,0.0,0,one-off,,CN,RMB,0,Zhejiang Big Data Exchange,
