title,description,price,category,update_frequency,url,category_aws,size,volume,price_mode,provider,coverage,currency,dimension,platform,data_sample
新运营商三要素验证(身份证+姓名+手机),"三网手机号码实名认证，运营商实名认证
运营商实名认证接口，通过比对姓名、身份证号、手机号的一致性，核验手机用户身份信息的真伪。三网合一，支持电信、联通、移动运营商的手机号核验。直连权威数据源，提供高精准优质服务，数据实时更新，毫秒级响应，保证验证的时效性和有效性，满足各项验证需求。",0.5,金融科技,irregular,https://ditm.zjdex.com/data-service/product-details?id=1458736983698976770&displayPrice=0.50%E5%85%83%2F%E6%AC%A1&productType=2,Financial Services Data,109951162777600.0,0,usage-based,,CN,RMB,0,Zhejiang Big Data Exchange,
天道分 V2-互联网现金分期场景分,产品描述：自行研发而来，使用银行、互金、理财、保险等多领域活跃度数据以及信贷历史行为数据训练而来，值在0~1之间，值越大，坏用户概率越高。产品优势：1、训练样本丰富，覆盖多个互联网金融机构2、底层信息多元，覆盖收支、借贷、理财、保险等多领域行为数据产品使用人群：金融机构、数据机构,0.3,金融科技,irregular,https://ditm.zjdex.com/data-service/product-details?id=1458764076033912833&displayPrice=0.30%E5%85%83%2F%E6%AC%A1&productType=2,Financial Services Data,10995116277760.0,0,usage-based,,CN,RMB,0,Zhejiang Big Data Exchange,
全景全息西安古城墙倾斜三维模型,"1比1真实还原西安古城墙。通过倾斜摄影技术，使用无人机对古城墙按规定的路线点位进行照片拍摄，具体技术参数如下：地面分辨率1.5cm
，飞行高度高于建模目标不超过30m ，无人机为大疆m600pro和大疆精灵4rtk，内业处理软件为photoshop、ContextCapture。
该成果数据为公司独立飞行制作完成，且不存在抄袭、复制他人作品的情形。",300000.0,城市治理,irregular,https://ditm.zjdex.com/data-service/product-details?id=1660602933171658754&displayPrice=300000.00%E5%85%83&productType=0,Public Sector Data,85899345920.0,0,one-off,,CN,RMB,0,Zhejiang Big Data Exchange,
二要素验证(身份证号和姓名),产品描述：输入姓名和身份证号，即可快速验证姓名与身份证号的真实性和一致性。可用于金融、保险、在线教育、新零售、电商、租赁、物流、旅游等需要实名认证场景。产品优势：直连权威数据源，提供高精准优质服务，数据实时更新，毫秒级响应，保证验证的时效性和有效性，满足各项验证需求,0.04,金融科技,irregular,https://ditm.zjdex.com/data-service/product-details?id=1458729528487194626&displayPrice=0.04%E5%85%83%2F%E6%AC%A1&productType=2,Financial Services Data,10995116277760.0,0,usage-based,,CN,RMB,0,Zhejiang Big Data Exchange,
天道分 V2-银行贷款场景分,产品描述：自行研发而来，使用银行、互金、理财、保险等多领域活跃度数据以及信贷历史行为数据训练而来，值在0~1之间，值越大，坏用户概率越高。产品优势：1、训练样本丰富，覆盖多个互联网金融机构2、底层信息多元，覆盖收支、借贷、理财、保险等多领域行为数据产品使用人群：金融机构、数据机构,0.3,金融科技,irregular,https://ditm.zjdex.com/data-service/product-details?id=1458760798483132418&displayPrice=0.30%E5%85%83%2F%E6%AC%A1&productType=2,Financial Services Data,0.0,0,usage-based,,CN,RMB,0,Zhejiang Big Data Exchange,
天道分 V2-银行信用卡场景分,产品描述：自行研发而来，使用银行、互金、理财、保险等多领域活跃度数据以及信贷历史行为数据训练而来，值在0~1之间，值越大，坏用户概率越高。产品优势：1、训练样本丰富，覆盖多个互联网金融机构2、底层信息多元，覆盖收支、借贷、理财、保险等多领域行为数据产品使用人群：金融机构、数据机构,0.3,金融科技,irregular,https://ditm.zjdex.com/data-service/product-details?id=1458759238470479874&displayPrice=0.30%E5%85%83%2F%E6%AC%A1&productType=2,Financial Services Data,10995116277760.0,0,usage-based,,CN,RMB,0,Zhejiang Big Data Exchange,
产业大数据,产品名称：产业大数据产业应用场景：应用在产业链精准拓客和产业链招商产品介绍：9大战兴产业链图谱；产业链上企业，产品，专利，政策，舆情，投融资，人才，园区；精准推荐链上优质企业及企业画像信息（生物医药、新能源、汽车、高端装备制造、新材料、新一代信息技术等）数据来源：工商、知识产权局、政府部门、互联网新闻站点、高校，行业协会等,300000.0,企业服务,real-time,https://ditm.zjdex.com/data-service/product-details?id=1692374904167145474&displayPrice=300000.00%E5%85%83&productType=0,"Retail, Location & Marketing Data",10995116277760.0,0,one-off,,CN,RMB,0,Zhejiang Big Data Exchange,
天道分 V2-互联网综合场景分,产品描述：自行研发而来，使用银行、互金、理财、保险等多领域活跃度数据以及信贷历史行为数据训练而来，值在0~1之间，值越大，坏用户概率越高。产品优势：1、训练样本丰富，覆盖多个互联网金融机构2、底层信息多元，覆盖收支、借贷、理财、保险等多领域行为数据产品使用人群：金融机构、数据机构,0.3,金融科技,irregular,https://ditm.zjdex.com/data-service/product-details?id=1458766898519486466&displayPrice=0.30%E5%85%83%2F%E6%AC%A1&productType=2,Financial Services Data,10995116277760.0,0,usage-based,,CN,RMB,0,Zhejiang Big Data Exchange,
天御分 V1-互联网消费金融场景分,产品描述：自行研发而来，使用银行、互金、理财、保险等多领域活跃度数据以及信贷历史行为数据训练而来，值在0~1之间，值越大，坏用户概率越高。产品优势：1、训练样本丰富，覆盖多个互联网金融机构2、底层信息多元，覆盖收支、借贷、理财、保险等多领域行为数据,0.3,金融科技,real-time,https://ditm.zjdex.com/data-service/product-details?id=1458769455019077633&displayPrice=0.30%E5%85%83%2F%E6%AC%A1&productType=2,Financial Services Data,109951162777600.0,0,usage-based,,CN,RMB,0,Zhejiang Big Data Exchange,
天道分 V2-银行综合场景分,产品描述：自行研发而来，使用银行、互金、理财、保险等多领域活跃度数据以及信贷历史行为数据训练而来，值在0~1之间，值越大，坏用户概率越高。产品优势：1、训练样本丰富，覆盖多个互联网金融机构2、底层信息多元，覆盖收支、借贷、理财、保险等多领域行为数据,0.3,金融科技,real-time,https://ditm.zjdex.com/data-service/product-details?id=1458762323406237697&displayPrice=0.30%E5%85%83%2F%E6%AC%A1&productType=2,Financial Services Data,109951162777600.0,0,usage-based,,CN,RMB,0,Zhejiang Big Data Exchange,
企业评价指标V2.0,查询返回创新能力_等级，社会贡献_等级，成长性_等级，经营风险_等级，企业名称，综合实力_得分，活跃度_得分，合法合规_得分，创新能力_得分，社会贡献_得分，成长性_得分，经营风险_得分，综合实力_等级，活跃度_等级，合法合规_等级,3.9,企业服务,no-update,https://ditm.zjdex.com/data-service/product-details?id=1522466711384301569&displayPrice=3.90%E5%85%83%2F%E6%AC%A1&productType=2,"Retail, Location & Marketing Data",0.0,0,usage-based,,CN,RMB,0,Zhejiang Big Data Exchange,
三要素验证详版（全网）,"介绍：金融机构提供认证对象的手机号码、证件号、姓名，判断三要素相互之间的匹配情况，确认用户身份，防止身份伪冒、虚构的情况发生。根据申请者信息验真情况，判断金融业务申请是否存在风险。适用场景：适用于金融行业贷款审批、反欺诈、身份验证等业务场景。客户要求：三要素相关接口要求客户必须满足：银保监会、证监会发布的最新名单名单为准，其他客户需通过四方联审。测试要求：如需测试需要填写测试申请并盖章审核。![图片](https://ditmupload.zjdex.com/tssl-df-
product/20220515/22bb38a81f5248daa0e8180bad5ff852.png)入参| 出参---|---1.手机号码2.身份证号3.姓名4.授权记录号| 1：手机号码、证件号、姓名三者匹配2：手机号码与姓名不匹配3：手机号码与证件号不匹配4：手机号码、证件号、姓名不匹配-1：非移动用户-2：数据异常",1.35,金融科技,no-update,https://ditm.zjdex.com/data-service/product-details?id=1525384963932495873&displayPrice=1.35%E5%85%83%2F%E6%AC%A1&productType=2,Financial Services Data,0.0,0,usage-based,,CN,RMB,0,Zhejiang Big Data Exchange,
水暖阀门行业-产品生产主数据,产品特点：跨企业数据综合：整合水暖阀门产业的关键生产数据，提供全方位的产业洞察。决策支持：帮助了解整个行业的生产趋势、关键指标，支持产业内部和外部的决策制定与生产流程管理。趋势分析：通过分析数据趋势和变化，揭示产业内的发展趋势和潜在机会。,9000.0,工业制造,no-update,https://ditm.zjdex.com/data-service/product-details?id=1737529919294611457&displayPrice=9000.00%E5%85%83&productType=0,Manufacturing Data,0.0,0,one-off,,CN,RMB,0,Zhejiang Big Data Exchange,
BPI2021年度指数数据,### 2021年度BPI指数数据,5000.0,工业制造,no-update,https://ditm.zjdex.com/data-service/product-details?id=1689081754942119937&displayPrice=5000.00%E5%85%83&productType=0,Manufacturing Data,0.0,0,one-off,,CN,RMB,0,Zhejiang Big Data Exchange,
天御分 V1-互联网综合场景分,产品描述：自行研发而来，使用银行、互金、理财、保险等多领域活跃度数据以及信贷历史行为数据训练而来，值在0~1之间，值越大，坏用户概率越高。产品优势：1、训练样本丰富，覆盖多个互联网金融机构2、底层信息多元，覆盖收支、借贷、理财、保险等多领域行为数据产品使用人群：金融机构、数据机构,0.3,金融科技,irregular,https://ditm.zjdex.com/data-service/product-details?id=1458770649301004290&displayPrice=0.30%E5%85%83%2F%E6%AC%A1&productType=2,Financial Services Data,10995116277760.0,0,usage-based,,CN,RMB,0,Zhejiang Big Data Exchange,
无极云影像平台,1.产品通过了药品监督管理局的医疗器械注册认证，注册证上满足区域级要求、云存储要求、移动端应用要求，且移动端具有三维后处理功能；2.通过了公安部颁发的三级安全等保认证；3.国内首个通过信创国产化认证云影像产品，满足医院未来10年国内政策要求；4.分布式高并发云影像技术引领者；5.产品已在国内多家门诊量超过400万以上大型综合医院使用；6.功能强大，拥有十六大应用功能模块;7.支持私有云或院内云存储部署。,10.0,医疗卫生,no-update,https://ditm.zjdex.com/data-service/product-details?id=1519851634386739201&displayPrice=10.00%E5%85%83%2F%E6%AC%A1&productType=2,Healthcare & Life Sciences Data,0.0,0,usage-based,,CN,RMB,0,Zhejiang Big Data Exchange,
义乌汽车站班次车辆信息,义乌汽车站车辆班次信息：1、义乌汽车发往金华市内外和浙江省内外各个目的地的车辆班次信息（包含班次号、客运站名称、排班执行日期、班次时间、驾驶员、到达站点、里程、实际载客量、车牌号等）。2、浙江省内以义乌为目的地的客运班车的车辆班次信息（包含班次号、客运站名称、排班执行日期、班次时间、驾驶员、到达站点、里程、实际载客量、车牌号等）。,0.5,交通物流,irregular,https://ditm.zjdex.com/data-service/product-details?id=1651523693730013186&displayPrice=0.50%E5%85%83%2F%E6%AC%A1&productType=2,Automotive Data,0.0,0,usage-based,,CN,RMB,0,Zhejiang Big Data Exchange,
水暖阀门行业-产品主数据标准,水暖阀门行业产品主数据标准是针对水暖阀门行业所设计的一套统一规范的数据定义和管理框架，致力于整合、规范和优化水暖阀门产品相关的主要数据元素，为企业和行业内的数据管理和交易提供统一的基准。特色与优势：全面性：涵盖水暖阀门产品的全方位数据，包括但不限于产品型号、规格、材料、性能参数、技术标准等核心信息。规范性：通过标准化的数据格式和结构，确保数据的一致性和可比性，简化了数据交换和共享过程。可扩展性：设计灵活，支持根据行业发展和需求变化进行数据的扩展和更新，保持标准的时效性和适用性。提高效率：标准化的主数据使企业能够更高效地管理产品信息，降低数据错误率，并加速产品上市和交易的过程。促进合作：作为统一的行业标准，有助于促进企业间合作与交流，推动行业内部信息共享与协作。应用领域：ERP和MES系统：该标准可以应用于企业的ERP和MES系统，为企业的数据管理和运营提供标准化、统一的基础。制造商与供应商关系：简化制造商与供应商之间的数据交流，提高供应链管理效率。市场销售与推广：协助企业更精准地定位目标市场，推广水暖阀门产品。数据分析与决策支持：为企业提供准确的数据基础，支持决策制定和战略规划。,10000.0,工业制造,no-update,https://ditm.zjdex.com/data-service/product-details?id=1735700569951772674&displayPrice=10000.00%E5%85%83&productType=0,Manufacturing Data,0.0,0,one-off,,CN,RMB,0,Zhejiang Big Data Exchange,
生物医药产业大数据,**生物医药产业大数据围绕药品、医疗器械、关键装备与原辅料、产业服务和医疗服务五大主线，涉及生物医药、原料药、化学制剂、蛋白药物、疫苗、抗体药物、血液制品、基因治疗、干细胞治疗、中成药、中药饮片、保健食品、医疗美容、医用软件、康复器械、医疗机器人、医学影像、体外诊断、可穿戴医疗设备、中医器械、放疗器械、输血/透析、低值耗材、高值耗材、制药装备、药用包材、CDMO、CRO医疗数字化等细分领域的数据,300000.0,医药卫生,real-time,https://ditm.zjdex.com/data-service/product-details?id=1678649434749739010&displayPrice=300000.00%E5%85%83&productType=0,Healthcare & Life Sciences Data,0.0,0,one-off,,CN,RMB,0,Zhejiang Big Data Exchange,
海洋生态环境数据,功能说明一、数据采集与挖掘数据采集与整合通过专业人工采集、传感器监测、水文观测站点等多源数据源，收集包括水质、沉积物、生物体质量、生物多样性、渔业资源等方面的海洋数据。在符合国家既定标准的前提下，确保了海洋数据的全面性和准确性，为后续的分析和应用提供可靠的基础与前提。数据挖掘与分析为了更深入地理解分析海洋数据，采用先进的数据挖掘和分析算法。通过这一功能，我们能够从海量数据中提取有价值的信息，识别趋势、模式和关联性，为科学研究和决策提供深度的支持。应用范围涵盖水文气象、水样沉积物、生物多样性等多个方面。二、海洋数据应用水质环境监测与评估[我们的海洋数据产品提供了全面的水质监测与评估功能，实时监测海水与淡水中的关键生态参数，包括但不限于溶解氧、温度、盐度、]()pH值等。用户可以通过海洋数据产品获取有关水体关键参数的需求信息。这有助于为用户提供全面而可靠的水质数据，推动水域生态系统的可持续发展，为人类创造更健康、更可持续的水资源环境。[沉积物分析]()[对于海洋底部的沉积物环境，基于数据采集整合，用户可以通过海洋数据产品追踪水底沉积物的有机碳、硫化物、石油等信息，更全面、深入地理解海洋生态系统的动态变化，为科学研究、环境监测、资源管理等海洋应用方面提供准确、可靠的海洋数据支持。]()[生物体质量与生物多样性评估]()[生物体质量和生物多样性是海洋生态系统的关键指标。我们的海洋数据产品通过生物采集统计、生态调查、生物体解剖分析等手段，追踪不同物种的数量、分布、生长状况，全面评估单位海域内海洋生物体的健康状况和多样性水平。这一功能有助于推动海洋保护和可持续管理，为深入了解海洋生态系统提供窗口和可靠的理论依据。]()[用户定制化服务]()[我们的海洋数据产品支持用户定制化服务。根据用户的具体需求，我们能够提供特定领域、特定时间范围的数据分析报告，满足用户在科研、决策等方面的个性化需求。](),500.0,城市治理,no-update,https://ditm.zjdex.com/data-service/product-details?id=1737297572792049665&displayPrice=500.00%E5%85%83&productType=0,Public Sector Data,0.0,0,one-off,,CN,RMB,0,Zhejiang Big Data Exchange,
绍兴市便民一体机的空间聚类数据,"一、应用场景：存在以下应用场景：（1）资源规划：通过对不同地区的空间密集度数据进行分析，可以合理规划资源分配，提高资源利用率和服务效率。（2）设备调度：根据不同地区的空间密集度数据，可以调度设备的位置和数量，减少客户的成本投入。（3）环境分析：通过对不同地区的空间密集度数据的变化情况进行分析，可以了解配置的环境因素对设备使用的影响，为设备维护和保养提供数据支持。二、算法规则简要说明：基于一体机各自的经纬度，结合聚类算法可以得出当台一体机方圆百米内存在的一体机总量，若百米内一体机总量超过10台，即判定该区域为热点区域，可结合实际配置需求决定是否要降低或调整该区域一体机分布情况。（1）非层次聚类算法：Sql for i = 1 to num_clusters do min_cost =for j = 1 to
num_data do if j != cluster_i do dist = cost_function(j, i) if dist < min_cost
then min_cost = dist cluster_i = j end if end if end for end for（2）层次聚类算法： Scss root_idx = k_min(distances, data_matrix) root_idx =
k_min(distances, indices, root_idx) k-means_algorithm(data_matrix, indices,
root_idx)",0.0,公共服务,irregular,https://ditm.zjdex.com/data-service/product-details?id=1727167904252370946&displayPrice=%E9%9D%A2%E8%AE%AE&productType=0,Public Sector Data,0.0,0,negotiation,,CN,RMB,0,Zhejiang Big Data Exchange,
绍兴市便民一体机办件量分析数据,一、应用场景：一体机办件量信息记录了一体机设备的月平均办件量、日平均办件量、密集办件时间范围及密集办件时间段。这些信息可用作分析绍兴市一体机办件量峰值情况、办件量高峰时间范围及办件量高峰持续时间，最终可根据数据调整一体机部署点位及数量。二、算法规则简要说明：根据人工采集的日办件、月办件量、办件时间等信息，计算获得对应一体机日、月办件量，并运用日期时间合并、日期时间拆分、计算间隔小时、计算间隔分钟等函数，最终获得月平均办件量、日平均办件量、量高峰时间范围、量高峰持续时间。,0.0,公共服务,irregular,https://ditm.zjdex.com/data-service/product-details?id=1727166909141164033&displayPrice=%E9%9D%A2%E8%AE%AE&productType=0,Public Sector Data,0.0,0,negotiation,,CN,RMB,0,Zhejiang Big Data Exchange,
外国采购商信用报告,“义乌常驻外国人采购商画像”数字产品：1、依托政府公共数据，通过市场采购信息、交易信息、经侦预警信息等维度对外国人采购商进行精准画像，为外国人办理居留证、邀请函等业务提供审批依据；2、基于外国人采购商交易行为信息、采购商基本信息、贸易信息、政府公共信息，提供外国人综合评价指标，为政府管理、优质客户筛选等业务提供业务指标；,5.0,公共服务,no-update,https://ditm.zjdex.com/data-service/product-details?id=1633299095309983746&displayPrice=5.00%E5%85%83%2F%E6%AC%A1&productType=2,Public Sector Data,0.0,0,usage-based,,CN,RMB,0,Zhejiang Big Data Exchange,
铝2014年度指数数据,铝2014年度指数数据,1000.0,工业制造,no-update,https://ditm.zjdex.com/data-service/product-details?id=1693062072216788994&displayPrice=1000.00%E5%85%83&productType=0,Manufacturing Data,0.0,0,one-off,,CN,RMB,0,Zhejiang Big Data Exchange,
铝2016年度指数数据,铝2016年度指数数据,1000.0,工业制造,no-update,https://ditm.zjdex.com/data-service/product-details?id=1693069934217338882&displayPrice=1000.00%E5%85%83&productType=0,Manufacturing Data,0.0,0,one-off,,CN,RMB,0,Zhejiang Big Data Exchange,
一标上市公司ESG底层数据,**向需求方提供2017年至2021年A股6000多家上市公司以及香港中资股1000多家上市公司披露的ESG定量数据，覆盖近80个定量指标，数据来源于上市公司披露的ESG报告、社会责任报告、可持续发展报告以及定期报告。涵盖环境及社会8大议题80+原始指标。供投资公司、基金公司从E、S和ESG角度准确衡量投资主体资产，高校和咨询公司利用高质量的ESG数据制作ESG报告等。,600000.0,金融科技,yearly,https://ditm.zjdex.com/data-service/product-details?id=1674228336373211137&displayPrice=600000.00%E5%85%83&productType=0,Financial Services Data,0.0,0,one-off,,CN,RMB,0,Zhejiang Big Data Exchange,
区域内数字文旅产业链和企业清单,**简要介绍：专业研究团队做产业定义、核心企业分类，产业链环节专业程度高。全国、省级、市级、区域等多层次，多范围的高质量链上企业名单输出。**使用建议：①产业发展：协助相关部门对数字文旅产业发展情况做判断。②产业招商：为各地招商工作提供招商资源池，助力推进数字文旅产业招商。③产业研究：为咨询机构做产业研究提供实用数据。**特别说明：产业链基础字段在数据集中直接提供，其他关联数据字段可定制化配置（榜单、投融资、专利）。,250000.0,公共服务,no-update,https://ditm.zjdex.com/data-service/product-details?id=1763404460369584129&displayPrice=250000.00%E5%85%83&productType=0,Public Sector Data,0.0,0,one-off,,CN,RMB,0,Zhejiang Big Data Exchange,
银行信用卡场景分,产品描述：融合数据宝与社会侧数据。比如数据宝侧公积金，社保缴费基数，连续缴费稳定性;使用社会侧信用卡正（还款表现良好）负（还款表现差或逾期情节严重）样本。使用机器学习算法（逻辑回归，树模型，神经网络）建立针对信用卡的信用评级模型。返回值在0~1之间，值越大，用户违约概率越高。应用场景:主要应用于银行信用卡核卡信用审核阶段。针对返回值较高的用户直接拒绝，针对返回值中低的用户进行信用卡差异化授信。,0.3,金融科技,irregular,https://ditm.zjdex.com/data-service/product-details?id=1540216264904613889&displayPrice=0.30%E5%85%83%2F%E6%AC%A1&productType=2,Financial Services Data,109951162777600.0,0,usage-based,,CN,RMB,0,Zhejiang Big Data Exchange,
企业信用分详情查询,启信分详情，包含企业资本背景，企业规模，成长性，知识产权，经营质量，风险状况的行业排名信息。（免责声明：评估结果是基于公开大数据计算而成，由于数据不完备，评估结果可能会存在一定的局限性，仅供参考，不能直接作为商业决策的依据。启信宝不对数据真实性、准确性、全面性、时效性负责，不承担使用者的任何商业风险，同时也不保证观点或陈述不发生任何变更。）,150.0,金融科技,no-update,https://ditm.zjdex.com/data-service/product-details?id=1530131786526040065&displayPrice=150.00%E5%85%83%2F%E6%AC%A1&productType=2,Financial Services Data,0.0,0,usage-based,,CN,RMB,0,Zhejiang Big Data Exchange,
义乌企业信用报告,"“义乌企业信用报告”数据产品：""数据主要覆盖义乌市境内的所有注册企业，报告数据维度如下：基础数据：企业注册基本信息、法人信息、董监高信息、投资情况信息、变更信息、企业章程等企业基本信息；资产信息：机动车信息、不动产登记信息、商位登记信息等资产信息；经营信息：公积金缴纳信息、社保缴纳信息、用水用气信息、债券融资等企业日常经营信息；金融信息：银行流水、收汇、授信、贷款以及担保、金融不良等金融信息；政府评价：纳税信用等级、慈善捐赠信息、归上企业、政府荣誉等相关政府评价信息；经营风险：水电气相关欠费信息、市场采购不良信息、以及各相关职能部门的不良信息等信息；法律风险：法院案件信息、未履行案件信息、失信后履行等相关法律风险信息；为金融机构对义乌小微企业主信用贷款提供贷前审核，贷中监管、客户识别、授信额度计算等业务场景中提供数据服务。",5.0,金融科技,no-update,https://ditm.zjdex.com/data-service/product-details?id=1633288474405314562&displayPrice=5.00%E5%85%83%2F%E6%AC%A1&productType=2,Financial Services Data,0.0,0,usage-based,,CN,RMB,0,Zhejiang Big Data Exchange,
