title,description,price,category,update_frequency,url,category_aws,size,volume,price_mode,provider,coverage,currency,dimension,platform,data_sample
有色指数2017年度指数数据,有色指数2017年度指数数据,5000.0,工业制造,no-update,https://ditm.zjdex.com/data-service/product-details?id=1691621514814365697&displayPrice=5000.00%E5%85%83&productType=0,Manufacturing Data,0.0,0,one-off,,CN,RMB,0,Zhejiang Big Data Exchange,
稀土指数2014年度指数数据,稀土指数2014年度指数数据,5000.0,工业制造,no-update,https://ditm.zjdex.com/data-service/product-details?id=1691717038640930817&displayPrice=5000.00%E5%85%83&productType=0,Manufacturing Data,0.0,0,one-off,,CN,RMB,0,Zhejiang Big Data Exchange,
稀土指数2015年度指数数据,稀土指数2015年度指数数据,5000.0,工业制造,no-update,https://ditm.zjdex.com/data-service/product-details?id=1691719146551320578&displayPrice=5000.00%E5%85%83&productType=0,Manufacturing Data,0.0,0,one-off,,CN,RMB,0,Zhejiang Big Data Exchange,
氟化工指数2011年度指数数据,氟化工指数2011年度指数数据,5000.0,工业制造,no-update,https://ditm.zjdex.com/data-service/product-details?id=1691994539049033730&displayPrice=5000.00%E5%85%83&productType=0,Manufacturing Data,0.0,0,one-off,,CN,RMB,0,Zhejiang Big Data Exchange,
氟化工指数2012年度指数数据,氟化工指数2012年度指数数据,5000.0,工业制造,no-update,https://ditm.zjdex.com/data-service/product-details?id=1691995004335759362&displayPrice=5000.00%E5%85%83&productType=0,Manufacturing Data,0.0,0,one-off,,CN,RMB,0,Zhejiang Big Data Exchange,
氯碱指数2019年度指数数据,氯碱指数2019年度指数数据,5000.0,工业制造,no-update,https://ditm.zjdex.com/data-service/product-details?id=1692011930428579841&displayPrice=5000.00%E5%85%83&productType=0,Manufacturing Data,0.0,0,one-off,,CN,RMB,0,Zhejiang Big Data Exchange,
氯碱指数2021年度行情数据,氯碱指数2021年度行情数据,5000.0,工业制造,no-update,https://ditm.zjdex.com/data-service/product-details?id=1692012517824077825&displayPrice=5000.00%E5%85%83&productType=0,Manufacturing Data,0.0,0,one-off,,CN,RMB,0,Zhejiang Big Data Exchange,
氯碱指数2021年度指数数据,氯碱指数2021年度指数数据,5000.0,工业制造,no-update,https://ditm.zjdex.com/data-service/product-details?id=1692012733805568002&displayPrice=5000.00%E5%85%83&productType=0,Manufacturing Data,0.0,0,one-off,,CN,RMB,0,Zhejiang Big Data Exchange,
丙烷2013年度产业链指数数据,丙烷2013年度产业链指数数据,5000.0,工业制造,no-update,https://ditm.zjdex.com/data-service/product-details?id=1692362053604024321&displayPrice=5000.00%E5%85%83&productType=0,Manufacturing Data,0.0,0,one-off,,CN,RMB,0,Zhejiang Big Data Exchange,
油菜籽2021年度行情数据,油菜籽2021年度行情数据,1000.0,工业制造,no-update,https://ditm.zjdex.com/data-service/product-details?id=1701502055348903938&displayPrice=1000.00%E5%85%83&productType=0,Manufacturing Data,0.0,0,one-off,,CN,RMB,0,Zhejiang Big Data Exchange,
碳酸钾2021年度指数数据,碳酸钾2021年度指数数据,1000.0,工业制造,no-update,https://ditm.zjdex.com/data-service/product-details?id=1702224035324829698&displayPrice=1000.00%E5%85%83&productType=0,Manufacturing Data,0.0,0,one-off,,CN,RMB,0,Zhejiang Big Data Exchange,
DMF2021年度指数数据,DMF2021年度指数数据,1000.0,工业制造,no-update,https://ditm.zjdex.com/data-service/product-details?id=1703641938620260353&displayPrice=1000.00%E5%85%83&productType=0,Manufacturing Data,0.0,0,one-off,,CN,RMB,0,Zhejiang Big Data Exchange,
DMF2022年度行情数据,DMF2022年度行情数据,1000.0,工业制造,no-update,https://ditm.zjdex.com/data-service/product-details?id=1703642132690706434&displayPrice=1000.00%E5%85%83&productType=0,Manufacturing Data,0.0,0,one-off,,CN,RMB,0,Zhejiang Big Data Exchange,
PET2022年度行情数据,PET2022年度行情数据,1000.0,工业制造,no-update,https://ditm.zjdex.com/data-service/product-details?id=1703642972780437506&displayPrice=1000.00%E5%85%83&productType=0,Manufacturing Data,0.0,0,one-off,,CN,RMB,0,Zhejiang Big Data Exchange,
白炭黑2021年度行情数据,白炭黑2021年度行情数据,1000.0,工业制造,no-update,https://ditm.zjdex.com/data-service/product-details?id=1703644710598025217&displayPrice=1000.00%E5%85%83&productType=0,Manufacturing Data,0.0,0,one-off,,CN,RMB,0,Zhejiang Big Data Exchange,
白炭黑2021年度指数数据,白炭黑2021年度指数数据,1000.0,工业制造,no-update,https://ditm.zjdex.com/data-service/product-details?id=1703644893218021377&displayPrice=1000.00%E5%85%83&productType=0,Manufacturing Data,0.0,0,one-off,,CN,RMB,0,Zhejiang Big Data Exchange,
白炭黑2022年度行情数据,白炭黑2022年度行情数据,1000.0,工业制造,no-update,https://ditm.zjdex.com/data-service/product-details?id=1703645155689177090&displayPrice=1000.00%E5%85%83&productType=0,Manufacturing Data,0.0,0,one-off,,CN,RMB,0,Zhejiang Big Data Exchange,
丙烯酸2021年度行情数据,丙烯酸2021年度行情数据,1000.0,工业制造,no-update,https://ditm.zjdex.com/data-service/product-details?id=1703645610448199682&displayPrice=1000.00%E5%85%83&productType=0,Manufacturing Data,0.0,0,one-off,,CN,RMB,0,Zhejiang Big Data Exchange,
丙烯酸2021年度指数数据,丙烯酸2021年度指数数据,1000.0,工业制造,no-update,https://ditm.zjdex.com/data-service/product-details?id=1703645872000802817&displayPrice=1000.00%E5%85%83&productType=0,Manufacturing Data,0.0,0,one-off,,CN,RMB,0,Zhejiang Big Data Exchange,
己内酰胺2021年度行情数据,己内酰胺2021年度行情数据,1000.0,工业制造,no-update,https://ditm.zjdex.com/data-service/product-details?id=1703651541244387329&displayPrice=1000.00%E5%85%83&productType=0,Manufacturing Data,0.0,0,one-off,,CN,RMB,0,Zhejiang Big Data Exchange,
甲酸2022年度行情数据,甲酸2022年度行情数据,1000.0,工业制造,no-update,https://ditm.zjdex.com/data-service/product-details?id=1703653532456656897&displayPrice=1000.00%E5%85%83&productType=0,Manufacturing Data,0.0,0,one-off,,CN,RMB,0,Zhejiang Big Data Exchange,
氯化石蜡2022年度行情数据,氯化石蜡2022年度行情数据,1000.0,工业制造,no-update,https://ditm.zjdex.com/data-service/product-details?id=1703689736996724738&displayPrice=1000.00%E5%85%83&productType=0,Manufacturing Data,0.0,0,one-off,,CN,RMB,0,Zhejiang Big Data Exchange,
硝酸钾2021年度行情数据,硝酸钾2021年度行情数据,1000.0,工业制造,no-update,https://ditm.zjdex.com/data-service/product-details?id=1703950360385363970&displayPrice=1000.00%E5%85%83&productType=0,Manufacturing Data,0.0,0,one-off,,CN,RMB,0,Zhejiang Big Data Exchange,
硝酸钾2022年度指数数据,硝酸钾2022年度指数数据,1000.0,工业制造,no-update,https://ditm.zjdex.com/data-service/product-details?id=1703951000960442370&displayPrice=1000.00%E5%85%83&productType=0,Manufacturing Data,0.0,0,one-off,,CN,RMB,0,Zhejiang Big Data Exchange,
义乌附近停车场停车情况查询,"义乌附近停车场停车情况查询，根据经纬度查询附近停车场停车情况使用get方式调用接口接口地址： <https://smart-parking.yccrm.cn/api/mini-program/nearby-parks>输入参数:latitude| 地点纬度---|---longitude| 地点经度radius| 半径,单位米parkType| 可选,停车场类型,1=路内停车场,2=路外停车场返回返回:id| 停车场id---|---name| 停车场名type| 停车场类型distance| 距离,单位米address| 停车场地址parkingSpace| 总车位remainingSpace| 剩余车位description| 车场描述,包括收费信息longitudeLatitude| 停车场地址,经度纬度调用示例： [https://smart-parking.yccrm.cn/api/mini-program/nearby-
parks?latitude=29.337086&longitude=120.108126&radius=5000](https://smart-
parking.yccrm.cn/api/mini-program/nearby-
parks?latitude=29.337086&longitude=120.108126&radius=5000)",0.1,交通物流,no-update,https://ditm.zjdex.com/data-service/product-details?id=1747164093462814721&displayPrice=0.10%E5%85%83%2F%E6%AC%A1&productType=2,Automotive Data,0.0,0,usage-based,,CN,RMB,0,Zhejiang Big Data Exchange,
DDGS2021年度行情数据,DDGS2021年度行情数据,1000.0,工业制造,no-update,https://ditm.zjdex.com/data-service/product-details?id=1701871810257821697&displayPrice=1000.00%E5%85%83&productType=0,Manufacturing Data,0.0,0,one-off,,CN,RMB,0,Zhejiang Big Data Exchange,
EVA2021年度指数数据,EVA2021年度指数数据,1000.0,工业制造,no-update,https://ditm.zjdex.com/data-service/product-details?id=1701872832560701442&displayPrice=1000.00%E5%85%83&productType=0,Manufacturing Data,0.0,0,one-off,,CN,RMB,0,Zhejiang Big Data Exchange,
双氧水2022年度指数数据,双氧水2022年度指数数据,1000.0,工业制造,no-update,https://ditm.zjdex.com/data-service/product-details?id=1701889851817402370&displayPrice=1000.00%E5%85%83&productType=0,Manufacturing Data,0.0,0,one-off,,CN,RMB,0,Zhejiang Big Data Exchange,
维生素A2022年度行情数据,维生素A2022年度行情数据,1000.0,工业制造,no-update,https://ditm.zjdex.com/data-service/product-details?id=1701890083263291394&displayPrice=1000.00%E5%85%83&productType=0,Manufacturing Data,0.0,0,one-off,,CN,RMB,0,Zhejiang Big Data Exchange,
甲醛2022年度指数数据,甲醛2022年度指数数据,1000.0,工业制造,no-update,https://ditm.zjdex.com/data-service/product-details?id=1702212065741709314&displayPrice=1000.00%E5%85%83&productType=0,Manufacturing Data,0.0,0,one-off,,CN,RMB,0,Zhejiang Big Data Exchange,
钛精矿2021年度指数数据,钛精矿2021年度指数数据,1000.0,工业制造,no-update,https://ditm.zjdex.com/data-service/product-details?id=1702223253695307777&displayPrice=1000.00%E5%85%83&productType=0,Manufacturing Data,0.0,0,one-off,,CN,RMB,0,Zhejiang Big Data Exchange,
钛精矿2022年度行情数据,钛精矿2022年度行情数据,1000.0,工业制造,no-update,https://ditm.zjdex.com/data-service/product-details?id=1702223474563162113&displayPrice=1000.00%E5%85%83&productType=0,Manufacturing Data,0.0,0,one-off,,CN,RMB,0,Zhejiang Big Data Exchange,
贵州煤矿用电监测,针对煤矿企业生产活动中存在超强度、超能力、偷采超产等重大隐患和违法违规行为监管监察信息化技术手段欠缺的痛点，构建煤炭行业企业生产情况分析数据产品。价格面议，支持定制化。,1000.0,城市治理,no-update,https://ditm.zjdex.com/data-service/product-details?id=1745284068618739713&displayPrice=1000.00%E5%85%83%2F%E6%AC%A1&productType=2,Public Sector Data,0.0,0,usage-based,,CN,RMB,0,Zhejiang Big Data Exchange,
道德信用贷,主要功能：基于余姚市个人公共数据，提取个人信用评估指标，可用于信贷准入、授信、贷后监管等业务流程。公共数据：居住证、户口、社保、养老保险、公积金、低保、失信、行政处罚等评估指标：证件状态，户籍归属、缴存状态、缴存基数，失信处罚状态等,10.0,金融科技,no-update,https://ditm.zjdex.com/data-service/product-details?id=1745331246980603906&displayPrice=10.00%E5%85%83%2F%E6%AC%A1&productType=2,Financial Services Data,0.0,0,usage-based,,CN,RMB,0,Zhejiang Big Data Exchange,
PTA2014年度指数数据,PTA2014年度指数数据,1000.0,工业制造,no-update,https://ditm.zjdex.com/data-service/product-details?id=1689529826256035841&displayPrice=1000.00%E5%85%83&productType=0,Manufacturing Data,0.0,0,one-off,,CN,RMB,0,Zhejiang Big Data Exchange,
丙烯2021年度产业链指数数据,丙烯2021年度产业链指数数据,5000.0,工业制造,no-update,https://ditm.zjdex.com/data-service/product-details?id=1689816183859781634&displayPrice=5000.00%E5%85%83&productType=0,Manufacturing Data,0.0,0,one-off,,CN,RMB,0,Zhejiang Big Data Exchange,
苯乙烯2012年度产业链指数数据,苯乙烯2012年度产业链指数数据,5000.0,工业制造,no-update,https://ditm.zjdex.com/data-service/product-details?id=1692373188982022146&displayPrice=5000.00%E5%85%83&productType=0,Manufacturing Data,0.0,0,one-off,,CN,RMB,0,Zhejiang Big Data Exchange,
苯乙烯2015年度产业链指数数据,苯乙烯2015年度产业链指数数据,5000.0,工业制造,no-update,https://ditm.zjdex.com/data-service/product-details?id=1692374890783121410&displayPrice=5000.00%E5%85%83&productType=0,Manufacturing Data,0.0,0,one-off,,CN,RMB,0,Zhejiang Big Data Exchange,
苯乙烯2016年度产业链指数数据,苯乙烯2016年度产业链指数数据,5000.0,工业制造,no-update,https://ditm.zjdex.com/data-service/product-details?id=1692375271739170818&displayPrice=5000.00%E5%85%83&productType=0,Manufacturing Data,0.0,0,one-off,,CN,RMB,0,Zhejiang Big Data Exchange,
苯乙烯2022年度产业链行情数据,苯乙烯2022年度产业链行情数据,5000.0,工业制造,no-update,https://ditm.zjdex.com/data-service/product-details?id=1692377263945490433&displayPrice=5000.00%E5%85%83&productType=0,Manufacturing Data,0.0,0,one-off,,CN,RMB,0,Zhejiang Big Data Exchange,
丙酮2021年度产业链指数数据,丙酮2021年度产业链指数数据,5000.0,工业制造,no-update,https://ditm.zjdex.com/data-service/product-details?id=1692442333576634370&displayPrice=5000.00%E5%85%83&productType=0,Manufacturing Data,0.0,0,one-off,,CN,RMB,0,Zhejiang Big Data Exchange,
甲醇2021年度指数数据,甲醇2021年度指数数据,1000.0,工业制造,no-update,https://ditm.zjdex.com/data-service/product-details?id=1692810890101596161&displayPrice=1000.00%E5%85%83&productType=0,Manufacturing Data,0.0,0,one-off,,CN,RMB,0,Zhejiang Big Data Exchange,
甲醇2022年度行情数据,甲醇2022年度行情数据,1000.0,工业制造,no-update,https://ditm.zjdex.com/data-service/product-details?id=1692811095119175682&displayPrice=1000.00%E5%85%83&productType=0,Manufacturing Data,0.0,0,one-off,,CN,RMB,0,Zhejiang Big Data Exchange,
螺纹钢2021年度行情数据,螺纹钢2021年度行情数据,1000.0,工业制造,no-update,https://ditm.zjdex.com/data-service/product-details?id=1692815688213405697&displayPrice=1000.00%E5%85%83&productType=0,Manufacturing Data,0.0,0,one-off,,CN,RMB,0,Zhejiang Big Data Exchange,
螺纹钢2021年度指数数据,螺纹钢2021年度指数数据,1000.0,工业制造,no-update,https://ditm.zjdex.com/data-service/product-details?id=1692815951519227906&displayPrice=1000.00%E5%85%83&productType=0,Manufacturing Data,0.0,0,one-off,,CN,RMB,0,Zhejiang Big Data Exchange,
铝2017年度行情数据,铝2017年度行情数据,1000.0,工业制造,no-update,https://ditm.zjdex.com/data-service/product-details?id=1693070227973808130&displayPrice=1000.00%E5%85%83&productType=0,Manufacturing Data,0.0,0,one-off,,CN,RMB,0,Zhejiang Big Data Exchange,
菜籽粕2022年度行情数据,菜籽粕2022年度行情数据,1000.0,工业制造,no-update,https://ditm.zjdex.com/data-service/product-details?id=1694243670689783810&displayPrice=1000.00%E5%85%83&productType=0,Manufacturing Data,0.0,0,one-off,,CN,RMB,0,Zhejiang Big Data Exchange,
LLDPE2021年度行情数据,LLDPE2021年度行情数据,1000.0,工业制造,no-update,https://ditm.zjdex.com/data-service/product-details?id=1694264424428937217&displayPrice=1000.00%E5%85%83&productType=0,Manufacturing Data,0.0,0,one-off,,CN,RMB,0,Zhejiang Big Data Exchange,
生猪2021年度指数数据,生猪2021年度指数数据,1000.0,工业制造,no-update,https://ditm.zjdex.com/data-service/product-details?id=1699676360406671362&displayPrice=1000.00%E5%85%83&productType=0,Manufacturing Data,0.0,0,one-off,,CN,RMB,0,Zhejiang Big Data Exchange,
小麦2022年度指数数据,小麦2022年度指数数据,1000.0,工业制造,no-update,https://ditm.zjdex.com/data-service/product-details?id=1699949149655080961&displayPrice=1000.00%E5%85%83&productType=0,Manufacturing Data,0.0,0,one-off,,CN,RMB,0,Zhejiang Big Data Exchange,
乙二醇2021年度行情数据,乙二醇2021年度行情数据,1000.0,工业制造,no-update,https://ditm.zjdex.com/data-service/product-details?id=1699950890182189057&displayPrice=1000.00%E5%85%83&productType=0,Manufacturing Data,0.0,0,one-off,,CN,RMB,0,Zhejiang Big Data Exchange,
乙二醇2022年度指数数据,乙二醇2022年度指数数据,1000.0,工业制造,no-update,https://ditm.zjdex.com/data-service/product-details?id=1699951434904838146&displayPrice=1000.00%E5%85%83&productType=0,Manufacturing Data,0.0,0,one-off,,CN,RMB,0,Zhejiang Big Data Exchange,
BPI2022年度指数数据,2022年度BPI指数数据,5000.0,工业制造,no-update,https://ditm.zjdex.com/data-service/product-details?id=1689102783592734722&displayPrice=5000.00%E5%85%83&productType=0,Manufacturing Data,0.0,0,one-off,,CN,RMB,0,Zhejiang Big Data Exchange,
BPI2014年度指数数据,BPI2014年度指数数据,5000.0,工业制造,no-update,https://ditm.zjdex.com/data-service/product-details?id=1689164902698786818&displayPrice=5000.00%E5%85%83&productType=0,Manufacturing Data,0.0,0,one-off,,CN,RMB,0,Zhejiang Big Data Exchange,
BPI2011年度指数数据,BPI2011年度指数数据,5000.0,工业制造,no-update,https://ditm.zjdex.com/data-service/product-details?id=1689166115276267522&displayPrice=5000.00%E5%85%83&productType=0,Manufacturing Data,0.0,0,one-off,,CN,RMB,0,Zhejiang Big Data Exchange,
纺织指数2019年度指数数据,纺织指数2019年度指数数据,5000.0,工业制造,no-update,https://ditm.zjdex.com/data-service/product-details?id=1689518956360704002&displayPrice=5000.00%E5%85%83&productType=0,Manufacturing Data,0.0,0,one-off,,CN,RMB,0,Zhejiang Big Data Exchange,
PTA2015年度指数数据,PTA2015年度指数数据,1000.0,工业制造,no-update,https://ditm.zjdex.com/data-service/product-details?id=1689530060344336385&displayPrice=1000.00%E5%85%83&productType=0,Manufacturing Data,0.0,0,one-off,,CN,RMB,0,Zhejiang Big Data Exchange,
丙烯2018年度产业链指数数据,丙烯2018年度产业链指数数据,5000.0,工业制造,no-update,https://ditm.zjdex.com/data-service/product-details?id=1689815507771531266&displayPrice=5000.00%E5%85%83&productType=0,Manufacturing Data,0.0,0,one-off,,CN,RMB,0,Zhejiang Big Data Exchange,
丙烯2021年度产业链行情数据,丙烯2021年度产业链行情数据,5000.0,工业制造,no-update,https://ditm.zjdex.com/data-service/product-details?id=1689820510653456385&displayPrice=5000.00%E5%85%83&productType=0,Manufacturing Data,0.0,0,one-off,,CN,RMB,0,Zhejiang Big Data Exchange,
化工指数2015年度指数数据,化工指数2015年度指数数据,5000.0,工业制造,no-update,https://ditm.zjdex.com/data-service/product-details?id=1691351417575120897&displayPrice=5000.00%E5%85%83&productType=0,Manufacturing Data,0.0,0,one-off,,CN,RMB,0,Zhejiang Big Data Exchange,
化工指数2020年度指数数据,化工指数2020年度指数数据,5000.0,工业制造,no-update,https://ditm.zjdex.com/data-service/product-details?id=1691352926593425410&displayPrice=5000.00%E5%85%83&productType=0,Manufacturing Data,0.0,0,one-off,,CN,RMB,0,Zhejiang Big Data Exchange,
化工指数2021年度指数数据,化工指数2021年度指数数据,5000.0,工业制造,no-update,https://ditm.zjdex.com/data-service/product-details?id=1691353530216685569&displayPrice=5000.00%E5%85%83&productType=0,Manufacturing Data,0.0,0,one-off,,CN,RMB,0,Zhejiang Big Data Exchange,
化工指数2022年度指数数据,化工指数2022年度指数数据,5000.0,工业制造,no-update,https://ditm.zjdex.com/data-service/product-details?id=1691353775281479681&displayPrice=5000.00%E5%85%83&productType=0,Manufacturing Data,0.0,0,one-off,,CN,RMB,0,Zhejiang Big Data Exchange,
建材指数2011年度指数数据,建材指数2011年度指数数据,5000.0,工业制造,no-update,https://ditm.zjdex.com/data-service/product-details?id=1691356248922595329&displayPrice=5000.00%E5%85%83&productType=0,Manufacturing Data,0.0,0,one-off,,CN,RMB,0,Zhejiang Big Data Exchange,
能源指数2012年度指数数据,能源指数2012年度指数数据,5000.0,工业制造,no-update,https://ditm.zjdex.com/data-service/product-details?id=1691377872438763521&displayPrice=5000.00%E5%85%83&productType=0,Manufacturing Data,0.0,0,one-off,,CN,RMB,0,Zhejiang Big Data Exchange,
有色指数2013年度指数数据,有色指数2013年度指数数据,5000.0,工业制造,no-update,https://ditm.zjdex.com/data-service/product-details?id=1691620660430446593&displayPrice=5000.00%E5%85%83&productType=0,Manufacturing Data,0.0,0,one-off,,CN,RMB,0,Zhejiang Big Data Exchange,
有色指数2020年度指数数据,有色指数2020年度指数数据,5000.0,工业制造,no-update,https://ditm.zjdex.com/data-service/product-details?id=1691628292964818945&displayPrice=5000.00%E5%85%83&productType=0,Manufacturing Data,0.0,0,one-off,,CN,RMB,0,Zhejiang Big Data Exchange,
氟化工指数2017年度指数数据,氟化工指数2017年度指数数据,5000.0,工业制造,no-update,https://ditm.zjdex.com/data-service/product-details?id=1691997107829547009&displayPrice=5000.00%E5%85%83&productType=0,Manufacturing Data,0.0,0,one-off,,CN,RMB,0,Zhejiang Big Data Exchange,
甲醇产业指数2014年度指数数据,甲醇产业指数2014年度指数数据,5000.0,工业制造,no-update,https://ditm.zjdex.com/data-service/product-details?id=1692002635276296194&displayPrice=5000.00%E5%85%83&productType=0,Manufacturing Data,0.0,0,one-off,,CN,RMB,0,Zhejiang Big Data Exchange,
甲醇产业指数2016年度指数数据,甲醇产业指数2016年度指数数据,5000.0,工业制造,no-update,https://ditm.zjdex.com/data-service/product-details?id=1692003416465416194&displayPrice=5000.00%E5%85%83&productType=0,Manufacturing Data,0.0,0,one-off,,CN,RMB,0,Zhejiang Big Data Exchange,
甲醇产业指数2021年度行情数据,甲醇产业指数2021年度行情数据,5000.0,工业制造,no-update,https://ditm.zjdex.com/data-service/product-details?id=1692007056949321729&displayPrice=5000.00%E5%85%83&productType=0,Manufacturing Data,0.0,0,one-off,,CN,RMB,0,Zhejiang Big Data Exchange,
丙酮2020年度产业链指数数据,丙酮2020年度产业链指数数据,5000.0,工业制造,no-update,https://ditm.zjdex.com/data-service/product-details?id=1692441964171698178&displayPrice=5000.00%E5%85%83&productType=0,Manufacturing Data,0.0,0,one-off,,CN,RMB,0,Zhejiang Big Data Exchange,
甲醇2021年度行情数据,甲醇2021年度行情数据,1000.0,工业制造,no-update,https://ditm.zjdex.com/data-service/product-details?id=1692810687239888897&displayPrice=1000.00%E5%85%83&productType=0,Manufacturing Data,0.0,0,one-off,,CN,RMB,0,Zhejiang Big Data Exchange,
PVC2013年度指数数据,PVC2013年度指数数据,1000.0,工业制造,no-update,https://ditm.zjdex.com/data-service/product-details?id=1693808259962183681&displayPrice=1000.00%E5%85%83&productType=0,Manufacturing Data,0.0,0,one-off,,CN,RMB,0,Zhejiang Big Data Exchange,
玻璃2021年度行情数据,玻璃2021年度行情数据,1000.0,工业制造,no-update,https://ditm.zjdex.com/data-service/product-details?id=1694249047657488386&displayPrice=1000.00%E5%85%83&productType=0,Manufacturing Data,0.0,0,one-off,,CN,RMB,0,Zhejiang Big Data Exchange,
鸡蛋2022年度指数数据,鸡蛋2022年度指数数据,1000.0,工业制造,no-update,https://ditm.zjdex.com/data-service/product-details?id=1694970480767475714&displayPrice=1000.00%E5%85%83&productType=0,Manufacturing Data,0.0,0,one-off,,CN,RMB,0,Zhejiang Big Data Exchange,
沥青2022年度行情数据,沥青2022年度行情数据,1000.0,工业制造,no-update,https://ditm.zjdex.com/data-service/product-details?id=1696799083356430338&displayPrice=1000.00%E5%85%83&productType=0,Manufacturing Data,0.0,0,one-off,,CN,RMB,0,Zhejiang Big Data Exchange,
炼焦煤2022年度指数数据,炼焦煤2022年度指数数据,1000.0,工业制造,no-update,https://ditm.zjdex.com/data-service/product-details?id=1696800223049490433&displayPrice=1000.00%E5%85%83&productType=0,Manufacturing Data,0.0,0,one-off,,CN,RMB,0,Zhejiang Big Data Exchange,
锰硅2021年度行情数据,锰硅2021年度行情数据,1000.0,工业制造,no-update,https://ditm.zjdex.com/data-service/product-details?id=1696800431351209986&displayPrice=1000.00%E5%85%83&productType=0,Manufacturing Data,0.0,0,one-off,,CN,RMB,0,Zhejiang Big Data Exchange,
锰硅2021年度指数数据,锰硅2021年度指数数据,1000.0,工业制造,no-update,https://ditm.zjdex.com/data-service/product-details?id=1696800654261690369&displayPrice=1000.00%E5%85%83&productType=0,Manufacturing Data,0.0,0,one-off,,CN,RMB,0,Zhejiang Big Data Exchange,
棉纱2022年度行情数据,棉纱2022年度行情数据,1000.0,工业制造,no-update,https://ditm.zjdex.com/data-service/product-details?id=1696807137342857218&displayPrice=1000.00%E5%85%83&productType=0,Manufacturing Data,0.0,0,one-off,,CN,RMB,0,Zhejiang Big Data Exchange,
顺丁橡胶2022年度指数数据,顺丁橡胶2022年度指数数据,1000.0,工业制造,no-update,https://ditm.zjdex.com/data-service/product-details?id=1699679281655521282&displayPrice=1000.00%E5%85%83&productType=0,Manufacturing Data,0.0,0,one-off,,CN,RMB,0,Zhejiang Big Data Exchange,
碳酸锂2022年度行情数据,碳酸锂2022年度行情数据,1000.0,工业制造,no-update,https://ditm.zjdex.com/data-service/product-details?id=1699680025070739457&displayPrice=1000.00%E5%85%83&productType=0,Manufacturing Data,0.0,0,one-off,,CN,RMB,0,Zhejiang Big Data Exchange,
铁矿石2022年度行情数据,铁矿石2022年度行情数据,1000.0,工业制造,no-update,https://ditm.zjdex.com/data-service/product-details?id=1699685030167257090&displayPrice=1000.00%E5%85%83&productType=0,Manufacturing Data,0.0,0,one-off,,CN,RMB,0,Zhejiang Big Data Exchange,
锌2021年度指数数据,锌2021年度指数数据,1000.0,工业制造,no-update,https://ditm.zjdex.com/data-service/product-details?id=1699949547497398274&displayPrice=1000.00%E5%85%83&productType=0,Manufacturing Data,0.0,0,one-off,,CN,RMB,0,Zhejiang Big Data Exchange,
